1396577119010963458,2021-05-23 21:21:46+00:00,"a jogar desta maneira um ano inteiro, no fim da época que já não tínhamos nada para ganhar, lá acordámos e começamos a jogar a bola e chegamos a uma final super importante após uma época horrível e jogam assim, fds"
1396577099746586626,2021-05-23 21:21:42+00:00,NUNO TAVARES E HORRÍVEL
1396576902899458049,2021-05-23 21:20:55+00:00,Vertoghen é horrível 🤣🤣🤣🤣🤣🤣🤣
1396576888194322434,2021-05-23 21:20:51+00:00,Vertoghen hoje esteve horrível. Foi comido em todas. Se não estava em condições simplesmente não jogava.
1396576881026215937,2021-05-23 21:20:50+00:00,Horrível
1396576844770643968,2021-05-23 21:20:41+00:00,Época horrível onde apostam quase o cu na equipa e não ganham nada.
1396576836671397898,2021-05-23 21:20:39+00:00,@liipaa07 eu não aguento é com este benfica a jogar horrível
1396576636833783809,2021-05-23 21:19:52+00:00,"Tava difícil Braga ahahaha
Fds que equipa horrível 🤦‍♂️🤦‍♂️"
1396576625622495238,2021-05-23 21:19:49+00:00,pode falar-se da entrada horrível do rafa ou quê
1396575860283613188,2021-05-23 21:16:46+00:00,Esta arbitragem está a ser horrível
1396575152037666818,2021-05-23 21:13:58+00:00,O Braga é tão horrível fds
1396574668442701826,2021-05-23 21:12:02+00:00,Braga é horrível
1396573706164580353,2021-05-23 21:08:13+00:00,"Para quem perde o primeiro campeonato em 9 e faz a época horrível que faz, isto não é carnaval a mais por terem ido à Champions graças ao deslize do adversário? https://t.co/DmaNKBS9O6"
1396570612697546754,2021-05-23 20:55:55+00:00,"@jogiiii @bandeiramarela Epa nao deve ser assim tao mau! E agora falando a serio, se na pizza fica bom aqui nao deve ser horrível!!"
1396570416823652354,2021-05-23 20:55:09+00:00,O Braga é absolutamente horrível a finalizar
1396570323340890114,2021-05-23 20:54:46+00:00,porra mais valia nem terem aparecido que jogo horrivel
1396567942091968526,2021-05-23 20:45:19+00:00,"@Yoko1904 Ainda pergunta o que o árbitro assinalou...

Que horrível."
1396567450574073858,2021-05-23 20:43:21+00:00,E agora sai dos postes para agarrar a bola e emendar o erro do colega? Horrível
1396566786489860098,2021-05-23 20:40:43+00:00,Não é por nada não mas que futebol horrível é esse do palmeiras slk
1396566332766834696,2021-05-23 20:38:55+00:00,"@faisca10420 Ele parou, ele hesita, aprendi nos iniciados que quando um guarda redes sai não se pode hesitar. Guarda redes mau, volto a repetir, intocável entre os postes horrível em tudo o resto"
1396564536086388738,2021-05-23 20:31:46+00:00,"@Don_Miguez Toca. Mas não era vermelho.
Exibição horrível do árbitro e do Ody"
1396564514426982400,2021-05-23 20:31:41+00:00,"pessimo a jogar com os pés, pessimo no posicionamento, atitude horrivel só porque quer sair. RUA BOI DO CARALHO"
1396564430998188032,2021-05-23 20:31:21+00:00,@ligaptdadepre O galeno a rematar é só horrível
1396563898610982918,2021-05-23 20:29:14+00:00,"Os 2 têm culpa, a saída foi horrível mas o corte foi uma merda https://t.co/hnbDZuLzh3"
1396563624236302341,2021-05-23 20:28:09+00:00,"O guarda redes esteve horrível , mas se não fosse uma injusta expulsão , ele ainda estava a aquecer o banco e não acontecia isto . Ponto"
1396563449669378058,2021-05-23 20:27:27+00:00,Ya jogo mais q esse guarda redes horrível
1396562792438771712,2021-05-23 20:24:51+00:00,Guarda redes muito bom dentro de postes mas horrível fora deles
1396562778085904384,2021-05-23 20:24:47+00:00,"Cerveja é só horrível, desculpem"
1396562752458604545,2021-05-23 20:24:41+00:00,@gcarvalhinho79 mano é q é tão horrivel q até arde nos olhos fds
1396562618794618885,2021-05-23 20:24:09+00:00,Forma bastante saudável de lidar com uma quantidade de ansiedade horrível 😀 https://t.co/ysqU7rrWF2
1396562567238230017,2021-05-23 20:23:57+00:00,"@rffonseca_ O Vlachodimos não sabe o que é sair, é simplesmente horrível"
1396562511927943174,2021-05-23 20:23:44+00:00,Vlacho foi horrível neste lance esqueçam
1396562458161078275,2021-05-23 20:23:31+00:00,Horrível ver uma final e não ter o Corinthians nela 🤯
1396562447960526856,2021-05-23 20:23:29+00:00,Para quem diz que o Vlachodimos é bom guarda redes não só entre os postes ahahahahah horrível
1396561192643072000,2021-05-23 20:18:29+00:00,Arbitro horrível
1396561102192975873,2021-05-23 20:18:08+00:00,"@beingapotato Vou fazer primeiro o sketch e depois passo para o programa 😂😂 ima take a long ass time tho, also acho que não vou fazer com personagem (sorry pela qualidade horrivel) https://t.co/EnqHRliD7V"
1396560703494963202,2021-05-23 20:16:33+00:00,é horrível...mas é o que têm de ser
1396560096394633217,2021-05-23 20:14:08+00:00,"Tento reclamar o menos possível pq sou uma privilegiada, mas estou a passar uma fase horrível da minha vida e eu não estou a saber lidar com ela"
1396557884759150594,2021-05-23 20:05:21+00:00,"neymar errou um pênalti e o palmeiras tá perdendo, que dia horrível"
1396555883790864399,2021-05-23 19:57:24+00:00,E eu a pensar q ia ser horrível qd soube q ia ficar com a casa. Pensei lg na merda q era eu me sentir só... mas guess what?! Ainda não me senti pq finalmente descobri QUE EU SOU A MINHA MELHOR COMPANHIA
1396555140170125316,2021-05-23 19:54:26+00:00,"Chega meu! Por favor, deem um jeito de tirar esse inútil do Marcelo lomba do gol do inter.. PQP QUE CARA HORRÍVEL"
1396552889003384841,2021-05-23 19:45:30+00:00,O meu trabalho de ev está horrível:(
1396552852634578947,2021-05-23 19:45:21+00:00,"Sinto-me horrivel💔
Este peso nunca mais me sai de cima🥺"
1396552575172947973,2021-05-23 19:44:15+00:00,"Relembrem-me lá porque é que houve malta a mandar vir com a sad por causa do Galeno? Por 3 ou 4 bons jogos? 

A tomada de decisão é horrivel. no mínimo"
1396550725799452676,2021-05-23 19:36:54+00:00,@RMPoficial Jogo horrível
1396544937466994696,2021-05-23 19:13:54+00:00,ver uma amizade a morrer assim e horrível
1396542773818531840,2021-05-23 19:05:18+00:00,"Estava na gelataria do furadouro e presenciei uma coisa horrivel mesmo e oh mais estupido foi uam empregada dizer ""outra vez"" havia uma crianca com que 11 anos 12 por ai a vender pensos daqueles das feridas  e a menina foi la e diss ah nao podes tar aqui e ele foi la dentro e...."
1396541701590765575,2021-05-23 19:01:02+00:00,"@martiimsa Coisa horrível aquela merda fse
Palhaçada"
1396540472831746056,2021-05-23 18:56:09+00:00,@filipeheath Isso é horrível e falta de consideração pelo teu tempo e esforço
1396539752938094604,2021-05-23 18:53:18+00:00,Que banco horrível meu Deus do céu https://t.co/mIqXeTpJnL
1396539145670037504,2021-05-23 18:50:53+00:00,"como nessa temporada horrível o Liverpool terminou em terceiro, não tô reclamando"
1396538735056105473,2021-05-23 18:49:15+00:00,A cada dia que passa sinto me mais sozinho ... parece que estou a isolar me do mundo .. é horrível sentir solidão !
1396536733349646338,2021-05-23 18:41:18+00:00,"Péssimo, horrível, podre, e muito mais, o incrível é a falta de comunicação entre eles. Sinceramente.😪 https://t.co/8WGDHe3fv5"
1396532728502398976,2021-05-23 18:25:23+00:00,"Horrível , é essa a palavra pra este jogo , horrível ."
1396529623056490505,2021-05-23 18:13:03+00:00,Deve ser horrível dormir sem mim 😪
1396528820224679937,2021-05-23 18:09:51+00:00,O Pirlo é um treinador horrível. Espero que levem capote e que o Ronaldo saia finalmente desse clube. https://t.co/UctmmRmhKR
1396525780792971267,2021-05-23 17:57:46+00:00,"Só quero a minha cama, cansaço horrível"
1396519891872722944,2021-05-23 17:34:22+00:00,"desisti de história, isto é horrível"
1396517960534081537,2021-05-23 17:26:42+00:00,"Eu a estudar QF sou tp: fds isto é horrivel quero falecer

*começa musica do xtinto*

Eu: Nah, vida mm é lifeCoração negro"
1396514942304628747,2021-05-23 17:14:42+00:00,Passar o dia sem tem com quem falar sem ter o que fazer sem ter onde ir é horrível tou a horas parado no quarto a tentar inventar algo pra fazer
1396511690439725061,2021-05-23 17:01:47+00:00,@brunazrafaela AHAHAHAH ainda por cima era horrível plmds
1396509049181642752,2021-05-23 16:51:17+00:00,@aNicotela fico horrível c essa voz😖
1396507579631783938,2021-05-23 16:45:27+00:00,quem inventou o spss e as referências espero que esteja a ter uma tarde horrível
1396505584116064263,2021-05-23 16:37:31+00:00,"É impressionante como é que duma posição horrível, o Liverpool ainda vai acabar em 3"
1396505406365700097,2021-05-23 16:36:49+00:00,@MaeEuclides @dhearantes 😂😂😂😂 @AdriDricaDidica disse que é horrível!!!
1396504321597087748,2021-05-23 16:32:30+00:00,"Enfim...horrível estes 2 ataques!
10 pontos de diferença.
57-67 últimos 5 min.
#FCPortoBasquetebol"
1396503554798628874,2021-05-23 16:29:27+00:00,@belita11 Eu cá só achei a música horrível. E adorei ver o colega olhar admirado para ele quando ele fazia linha naquela sala de bingo 🤣🤣🤣
1396502848586895362,2021-05-23 16:26:39+00:00,@samuelmmelo EU TAMBEM FOI HORRIVEL E AGORA O STOR DISSE PARA NOS FAZERMOS OUTRA VEZ OU FAZIAMOS PROVA ORAL PRESENCIAL E EU ODEIO PROVA ORAL ENTAO VOU MANDAR OS VIDEOS MAS E BUE EMBARASSING DJHYSAKDHGS
1396495389843501058,2021-05-23 15:57:01+00:00,"@daniela_veloso_ Infelizmente Deus decidiu que tínhamos de sentir está dor horrível 😔 por mais afastadas que estejamos, sempre te disse que podes contar comigo para tudo!"
1396493289319280640,2021-05-23 15:48:40+00:00,Que jogo horrível do chelsea
1396490831100579848,2021-05-23 15:38:54+00:00,A música da Itália é horrível fds
1396486850995499008,2021-05-23 15:23:05+00:00,@cabreuamorim @MiguelFontesPe1 Aposto que com cola daquelas difíceis de tirar. Horrível
1396484327832178692,2021-05-23 15:13:03+00:00,Que ano horrível 😞
1396484161909796866,2021-05-23 15:12:24+00:00,"@carmoafonso Claro que sim, a cusquice é um defeito horrível"
1396481284310978560,2021-05-23 15:00:58+00:00,Basquetebol português é mesmo fraco e horrível jesus
1396480632289644550,2021-05-23 14:58:22+00:00,"@ana_pessoaaaa @JanineSimao, que jogo horrível"
1396476861471940613,2021-05-23 14:43:23+00:00,que morte horrível da mercedes
1396473727970418689,2021-05-23 14:30:56+00:00,@biscathhe Eh extremamente horrível
1396472126866169857,2021-05-23 14:24:34+00:00,Era para ir ao freeport mas ta uma fila horrível só pra entrar no freeport! Imagino para as lojas!!
1396468553935691780,2021-05-23 14:10:23+00:00,@jcostamarinho @tiagodteixeira @BanhoBola @JoaoAlmeidaRosa @anafmreis13 @tomasrdacunha @SofiaOlive7ra @asofia_santana @joaotiberio @diogogc_ @hugotiago_ @jose11fernando Horrível!
1396467624503033862,2021-05-23 14:06:41+00:00,"~horrivel, se a raparigar falar muito o rapaz eventualmente vai deixar de ouvir https://t.co/229nm4GeNO"
1396467422304034816,2021-05-23 14:05:53+00:00,"@gloriagroove Deve ser horrível Dormir sem mim😌💖
Tua voz👥💙"
1396466968216182784,2021-05-23 14:04:04+00:00,@saidadeumlivro @FCPorto Vai ser horrível! Camisola linda do @FCPorto é só aquela que tenha o símbolo de campeão
1396464847064289283,2021-05-23 13:55:39+00:00,Horrível este GP do Mónaco para a Mercedes...😐
1396464611633864705,2021-05-23 13:54:43+00:00,Essa nova fanta mistério é horrivel 🤮
1396463327300173829,2021-05-23 13:49:36+00:00,@c_martins55 Que coisa horrível
1396463083346870279,2021-05-23 13:48:38+00:00,Que corrida horrível para a Mercedes
1396460409197154304,2021-05-23 13:38:01+00:00,Estudar ao domingo é horrível
1396458603251384321,2021-05-23 13:30:50+00:00,"@babslgomes Tá horrível, eu vi"
1396458514453831686,2021-05-23 13:30:29+00:00,"Ter que passar pelas turbulências da vida quieta e sozinha é horrível, não desejo a ninguém"
1396456459605528579,2021-05-23 13:22:19+00:00,@gloriagroove ai por favor nao q coisa horrivel
1396447909269417987,2021-05-23 12:48:20+00:00,Investigação horrível. Mas quando fazes uma conclusão com todos os dados que recolheste é maravilhoso.
1396447394217304065,2021-05-23 12:46:18+00:00,Horrível para quem tem miopias https://t.co/YGYbBX4Tm1
1396447320141598720,2021-05-23 12:46:00+00:00,vocês também não se sentem bué dependentes de pessoas específicas? é uma sensação tão horrível wtf o que é que elas têm de diferente das outras pra eu estar assim lmao
1396445478116634624,2021-05-23 12:38:41+00:00,Horrível este impacto para o Leclerc.
1396444983209639939,2021-05-23 12:36:43+00:00,"@FlaRei_1895 Não gosto de nenhum dos dois, mas a comparação é injusta. Quanto desse tempo o Renato ficou preso em times horríveis, principalmente Fluminense e Vasco? Se estivesse no Fla, muito provavelmente teria ganho o mesmo que o horrível Ceni, talvez até algo mais."
1396444634906308612,2021-05-23 12:35:20+00:00,"@_MiguelJesus Era horrível! Lembro-me de uma vez receber uma mensagem a pedirem para responder, porque me viram a fazer gostos através dessa funcionalidade e perceberam que estava online 😅"
1396441702433439748,2021-05-23 12:23:41+00:00,O pull-out game da baleia é horrível https://t.co/w7f8pxmYF0
1396437154935476229,2021-05-23 12:05:36+00:00,@elyprivv juro horrivel
1396435350994685955,2021-05-23 11:58:26+00:00,que sonho horrível com minha mãe😭
1396432376549580801,2021-05-23 11:46:37+00:00,"@cleacourgette Okay, já a ouvi e não a achei horrível xD not my cup of tea either, mas cum caneco, será mesmo de prepósito?!"
1396430745770602498,2021-05-23 11:40:08+00:00,Dor de cabeça horrível
1396428691203403777,2021-05-23 11:31:59+00:00,Como é que aquela musica horrivel de italia ganhou meu?
1396416476203077639,2021-05-23 10:43:26+00:00,Que sonho horrível meu deus…
1396414632093442048,2021-05-23 10:36:07+00:00,"Tentar ligar para vocês é horrível, nunca me atendem"
1396411899059884034,2021-05-23 10:25:15+00:00,Já chorei à frente do meu pai e é horrível https://t.co/7UsgAHxipt
1396406558813261826,2021-05-23 10:04:02+00:00,Usar máscara tem deixado minha pele horrível. 😣
1396406430798860292,2021-05-23 10:03:31+00:00,@carmenfontao Que coisa horrível
1396401502621741060,2021-05-23 09:43:56+00:00,"@hugompalma Porra, ainda há dias me queixei aqui da conta da edp. Não me convence (tenho lido sobre a extração do lítio e é horrível. Há um documentário excelente sobre isso: https://t.co/80EhTCc3pb). Talvez o hidrogénio seja a melhor a opção."
1396400984784572416,2021-05-23 09:41:53+00:00,acordei com uma dor de cabeça horrível
1396399354370568193,2021-05-23 09:35:24+00:00,"Alguém diga aos ingleses que a música deles era só horrível. 

#Eurovision"
1396397565764112387,2021-05-23 09:28:18+00:00,@natcha_g_ A música é horrível não estragues os ouvidos
1396391575845019648,2021-05-23 09:04:30+00:00,É horrível ter que acordar agora para tomar a medicação para voltar a dormir depois
1396387848702529538,2021-05-23 08:49:41+00:00,@bradzfnbr @PedgoPereira É horrível mas pediste para ir com ele hahaha fazes a piada sozinho bro
1397106145555357697,2021-05-25 08:23:56+00:00,"Credo que teste horrivel, alguém vai voar pela janela hoje."
1397104078124167172,2021-05-25 08:15:43+00:00,Que pesadelo horrível
1397102596205207555,2021-05-25 08:09:50+00:00,Só quero esquecer o pesadelo horrível que tive 😴😴
1397091966756720641,2021-05-25 07:27:36+00:00,"Ter aulas às 9 no secundário era ótimo, na faculdade é horrível, puor coisa do mundo"
1397089218648805382,2021-05-25 07:16:41+00:00,"@brunoalvesss4 Paraaaa Bruno, és horrível jr"
1397077950911107073,2021-05-25 06:31:54+00:00,"Está comichão está horrível, vou ficar com o pé em ferida"
1397077007687725059,2021-05-25 06:28:09+00:00,"Não quero ver a malta do trabalho. 1 dia depois da baixa e sempre horrível, levar com perguntas, Epa não"
1397039309329506305,2021-05-25 03:58:21+00:00,"@_barauna_ horrível, só escuto pra sofrer"
1397029279888814081,2021-05-25 03:18:30+00:00,"Eu sei que não tem obrigação mas peço por tudo se voltar a ver tire foto a matricula se não quizer denunciar escreva me dm que eu ligo para a esquadra tbn tenho uma filha menor 15 anos é horrível, horrível, assustador, nossa sra, de Fátima so pode ser pedófilo, denunciem. Obg https://t.co/mj7XQMXClz"
1397006712087977985,2021-05-25 01:48:49+00:00,@tetenc555 sim ta horrível
1396999460279001088,2021-05-25 01:20:00+00:00,"O design está horrível, por amor de deus. Há que abrir os olhos. https://t.co/ZJaz4mrRDX"
1396994130593685509,2021-05-25 00:58:50+00:00,Contemporânea é tão horrível puta que pariu tou tão fartoooooooooo
1396992836978057218,2021-05-25 00:53:41+00:00,Será que eu sou uma pessoa horrível??
1396989825979408386,2021-05-25 00:41:43+00:00,Caralho? Eu tinha certeza que esse cara ia ser horrível. https://t.co/54ytb7ZO3h
1396986237219713028,2021-05-25 00:27:28+00:00,"horrivel. de frango&gt;&gt;&gt;&gt;&gt;
(inclusive eu faço uma deliciosa, toda vez q digo q vou fazer pro meu namorado ou pra minha amiga eles ficam doidinhos pra virem aqui em casa comer) https://t.co/AsOMqEb2zn"
1396983258060046336,2021-05-25 00:15:38+00:00,@twsxj eu sou literalmente horrível nesse jogo
1396982023600934918,2021-05-25 00:10:43+00:00,"A pior parte da minha semana é de segunda a quinta 😭😭 eu odeio o fato do David ter que viajar pra trabalhar, distância é horrível."
1396981374268198918,2021-05-25 00:08:08+00:00,@ricky_martin ver o carro Graças a Deus 😅 É mesmo horrível 😞 é uma sensação péssima . A Polícia Judiciária funciona 🙂🙏Peço desculpa pelo desabafo . Eu não tinha coragem de ser famosa como você não tinha não 👎 Você é corajoso 🙂👍
1396980590587559937,2021-05-25 00:05:02+00:00,"@ricky_martin de pedir ajuda há Polícia Judiciária pois parava um carro com um casal de idosos sempre quase há porta do meu prédio e tive de pedir ajuda pois é horrível 😞 sair de casa e estar a ser observada e ao chegar a casa também , mas felizmente 😅 deixei de"
1396974004578230278,2021-05-24 23:38:51+00:00,"@57iamtenente Sou uma pessoa horrível, nem há discussão 😔"
1396973625320869890,2021-05-24 23:37:21+00:00,@_andreiarolim_ que neta HORRÍVEL 🥺🥺
1396966125242621957,2021-05-24 23:07:33+00:00,"@BiaCarvalho821 Horrível portanto ahah mas vão correr bem!
Obrigada querida! 🍀"
1396962246585159686,2021-05-24 22:52:08+00:00,"@rafael_conim nunca fumei iqos sequer, quanto mais 

mas aposto q é horrível"
1396952978192470021,2021-05-24 22:15:18+00:00,@mariana97409067 mano memo asr é horrível
1396951629878943757,2021-05-24 22:09:57+00:00,"@TorcidaOPLANO Porra dos timings do kng fuderam tudo
esse A tá horrivel, e o B parece o A
EU ACREDITO
UAAAAAAAAAAAAAAAAAAAAAAAAAAAA"
1396949711358136322,2021-05-24 22:02:19+00:00,que dia horrível
1396943268034850816,2021-05-24 21:36:43+00:00,"Boa noite.
Existem mitras e betos, mas nesta foto não vêm nenhum deles.
Nenhum beto teria o gosto horrível de usar calça vincada com sapatilhas e uma t-shirt fora das calças.
E a rapariga é alterna, claramente. https://t.co/e1W2svV26f"
1396940418034675714,2021-05-24 21:25:24+00:00,@CarolinePatatt O café do Starbucks é horrível. Eu pagava pelo Wi-Fi é ganhava um café ruim de brinde 😂
1396938739281186817,2021-05-24 21:18:43+00:00,@beatrizb38 É horrível ser tão novo e já com tantas dores de costas 🤦🏽‍♀️
1396938622650224640,2021-05-24 21:18:16+00:00,💚 (qualidade horrível) https://t.co/6I34zefsoQ
1396938478642991108,2021-05-24 21:17:41+00:00,A música da Ucrania foi horrível! https://t.co/F0Jzo2QI41
1396937759290499079,2021-05-24 21:14:50+00:00,Que sentimento horrível nunca mais me vou perdoar....
1396937355190325253,2021-05-24 21:13:13+00:00,Que horrível https://t.co/nqCOPjLvin
1396937339914620929,2021-05-24 21:13:10+00:00,"@ritxinha76 Pois não, é horrível ahahahah"
1396932693196165122,2021-05-24 20:54:42+00:00,Eu quero uma fartura do penim e já por duas vezes que fui lá e a fila está horrível 😭😭
1396929403456794626,2021-05-24 20:41:38+00:00,Que dia horrível
1396929346359775239,2021-05-24 20:41:24+00:00,Esta Ângela é tão tão horrível #amoramor
1396929063730696194,2021-05-24 20:40:17+00:00,@gofckurselfbby juroo é horrível
1396929031245811712,2021-05-24 20:40:09+00:00,"@LeLunaSL @VsBxS12 @SofaScoreBR @LucasPaqueta97 amigo, gattuso simplesmente odeia futebol com drible
E Paquetá da alguma dribles em muitas jogadas
Aquele Milan era HORRÍVEL tanto time quanto treinador
Você realmente não viu 30 min daquele Milan"
1396927765899796480,2021-05-24 20:35:07+00:00,"Isto tem sido uma luta constante comigo mesma, horrível"
1396925580377997316,2021-05-24 20:26:26+00:00,"Rever tudo aquilo que passei é horrível, eu chorei e tudo mas o pesadelo acabou"
1396924229594009605,2021-05-24 20:21:04+00:00,"@marekjusk @ppaodemonio @ojogo O estádio é lindo mas horrível para adeptos. É longe (Guimarães é no centro), frio (é aberto, no meio da pedra) e não é muito acessível pára adeptos mais velhos.

Ajuda que ir ver um jogo ao D. Afonso Henriques seja muito mais cómodo e prático que ver um em Braga."
1396919887944114176,2021-05-24 20:03:49+00:00,"Nuke horrivel da minha parte mas a minha equipa é muito forte, ganhamos 2-0 aos @VELOXgg, qualificamo-nos para o play-in e estamos já na próxima edição da @MasterLeaguePT BORA EQUIPA! @ftwesports
 #ftwCSGO #OMENFTW #TelepizzaFTW"
1396912680980598795,2021-05-24 19:35:11+00:00,@Maah_Martinsz sim horrivel
1396911942325915659,2021-05-24 19:32:15+00:00,Sou um péssimo pai de planta. Que morte horrível.
1396911836474183681,2021-05-24 19:31:49+00:00,"Há uma semana que tenho uma dor horrível no lado esquerdo das costas, devo preocupar-me?"
1396910340978446337,2021-05-24 19:25:53+00:00,tou a pressentir um verão horrível
1396905364562579465,2021-05-24 19:06:06+00:00,"Fodasse, nao quero mais treinos assim, que horrivel! Não treinei nada  e ainda por cima o sistema tinha mesmo de falhar hoje. O fitness up esta a desiludir bue."
1396898821364408325,2021-05-24 18:40:06+00:00,"n sei quem teve a ideia de usar Lda mas parabéns, fica horrível e dificulta a associação que os meus 3 neurónios funcionais conseguem fazer com spq https://t.co/5wKvI4w1qX"
1396893639427624965,2021-05-24 18:19:31+00:00,a minha saúde ta horrível e só piora
1396891575578468352,2021-05-24 18:11:19+00:00,Andar desencontrada de quem nós gostamos é horrível
1396890418562879488,2021-05-24 18:06:43+00:00,"Que dor de costas horrível, acho q em x de ter feito 23 anos fiz 53"
1396889673201561601,2021-05-24 18:03:45+00:00,OH SÉRGIO ANUNCIA Q VAIS PARA A ITÁLIA QUE É PARA TIRAR ESTA FOTO HORRÍVEL FDP
1396887445577289728,2021-05-24 17:54:54+00:00,"@Patrcia25520529 @IstoHojeEstaUma Odiar o Bruno ? Se há coisa que eu não odeio é o Bruno, acho que esta semana ele esteve horrível e apenas quem é fanático é que colabora com o que ele disse nesta última semana. Continuarei a seguir o Bruno e espero que algum dia ele veja o quanto errado esteve."
1396885242577817610,2021-05-24 17:46:09+00:00,"@Rodrifsilva_ A mim foi horrível,usei durante 4 anos"
1396885047312011267,2021-05-24 17:45:22+00:00,"@FabioAbilio @Pedro07mota @dwfla_ @carloscarvalha2 @SCBragaOficial É horrível ahaha, não sei o que o JJ viu nele"
1396882074208964609,2021-05-24 17:33:33+00:00,é horrível estar doente 🤧
1396881562629808143,2021-05-24 17:31:31+00:00,"Sem querer ser sectária...quando uma grande parte dos apoiantes de “aquele que não deve ser nomeado” se insurgem contra o corte de um apêndice capilar horrível, está tudo dito. 🤦‍♀️🤪"
1396875292715651082,2021-05-24 17:06:37+00:00,"@carregabenflca @DrNotavel Defende ao nível do Émerson ou Cortez, horrível. Ontem foi mais um show da parte dele, comido por todo lado fdx"
1396874182374400000,2021-05-24 17:02:12+00:00,"@JoaoBento1906 @XEunomieX @RuiPinto_FL O mal que o Homem fez foi o de incomodar muito, muitos poderosos, e isso para essas pessoas de bem é uma horrível coisa do mal."
1396866810792845316,2021-05-24 16:32:54+00:00,Honestamente estou com uma dor de cabeça horrível
1396865654666448898,2021-05-24 16:28:19+00:00,"@Folanoditau @filhosdelula @bock_lima @paulopellegri14 @gianoddi Que bom, porque esse argumento era mesmo horrível. Bastava ler a decisão do STF pra concluir que além de genocida o cara é mentiroso patológico."
1396863598241124355,2021-05-24 16:20:08+00:00,"@ifilipasp Opah olha eu de máscara fica horrível por causa da barba ne.
Sem máscara ajuda 🥲"
1396860746559107077,2021-05-24 16:08:49+00:00,@jaopoectic horrível bestie
1396855925953212420,2021-05-24 15:49:39+00:00,@CuriosidadesPRL Horrível
1396855860261961728,2021-05-24 15:49:24+00:00,"@nunovalinhas @UEFA Esta Conference League, dá é uma tradução péssima para português, ao contrário da Liga dos Campeões ou da Liga Europa, Liga Conferência é horrível"
1396855003231436806,2021-05-24 15:45:59+00:00,"fifa é mm horrível, n há palavras"
1396851624652517378,2021-05-24 15:32:34+00:00,Mano wtf? Q horrível https://t.co/mF0Fk99iCP
1396850566849048585,2021-05-24 15:28:22+00:00,"@sophiamitidieri horrível, parecia uma espécie de tráfico de crianças, e meio que me deixavam ter celular (?) e eu tava dirigindo o carro da minha mãe (?)"
1396848849319309313,2021-05-24 15:21:32+00:00,Dia horrível juro
1396845269866713092,2021-05-24 15:07:19+00:00,"Dar mais 500 euros por uma tampa para o pendura, um wind shield horrivel e uma protecção de deposito?
Lolitos"
1396842550288396289,2021-05-24 14:56:30+00:00,"@starsplotnikova Sim, antigamente a gestão do N.U era horrível! Hoje pode se dizer que tá melhorando."
1396839208250187777,2021-05-24 14:43:13+00:00,"@goncalocvale Então a voz é horrível, de fugir"
1396838802510032900,2021-05-24 14:41:37+00:00,Eu digo-vos como é que é depois de cinco anos: é horrível https://t.co/zwkeoDcH96
