1397597154521370628,2021-05-26 16:55:02+00:00,"O Benfica de LFV é todo um tratado de má gestão desportiva, quer nas contratações (jogador já com historial de lesões) quer na gestão das queixas físicas que apresentou durante meses https://t.co/dlKIKqhPMK"
1397596489606647810,2021-05-26 16:52:23+00:00,@jorgeraa Mau porque?! Novidades?
1397596080649408521,2021-05-26 16:50:46+00:00,"Senti um frio na barriga ao ver o vídeo do rapaz atropelado em consequência do bullying. Não é como diz a mãe da tal Jéssica, o menino não ""decidiu atravessar sem olhar"". O menino, transtornado, fugiu. Só isto. A culpa não é do menino, não é do condutor. É da má formação e do"
1397594444812197891,2021-05-26 16:44:16+00:00,A pessoa leva a mau tudo oq eu digo mdsssss que irritante
1397594437136551938,2021-05-26 16:44:14+00:00,"Eu juro, não há gaja que queira ser mais igual a mim 😂😂😂😂 ai q mau mesmo"
1397594297655042049,2021-05-26 16:43:41+00:00,"Paulinha, aconselho te  que tenhas  alguém contigo quando vires o meu teste...
Ainda te dá uma coisinha má!!!"
1397593934394757120,2021-05-26 16:42:14+00:00,@jdjustino Não ponho em causa a sua seriedade política mas na verdade tem vindo a prestar um mau serviço ao PSD ao tentar branquear o descalabro da liderança de Rui Rio.
1397590302500786177,2021-05-26 16:27:48+00:00,"@observadorpt Bastaria dizer "" o resto do país"". O Rui Moreira revela-se de mau caráter ao referir ""norte"". Esta estratégia de angariação de votos e do pior que a política tem"
1397590110451994632,2021-05-26 16:27:02+00:00,"@Danichi_Marques PCTP não é assim tão mau acho eu

(Change my mind)"
1397588769562374144,2021-05-26 16:21:43+00:00,Eu com 13 anos sabia a diferença de fazer algo bom e algo mau https://t.co/1TN41jggMD
1397587812753489924,2021-05-26 16:17:55+00:00,ABRE A PORTA TÁNIA. AGORA TOU BEM MAU. EU VOU ARROMBAR A PORTA
1397585500781883393,2021-05-26 16:08:43+00:00,"As crianças em questão têm cerca de 13 anos, não mais que isso, e sinceramente espero que as mesmas aprendam que bullying é crime, independentemente de ser crime ou não, é feio, repugnante é de mau carácter."
1397584593914667019,2021-05-26 16:05:07+00:00,"Este comunicado é mau a vários níveis. E é trumpismo em estado puro. Se houve quem ficasse preocupado c a ideia lançada pelo Louçã da Mortágua como ministra das finanças, fico mais preocupado em pensar no PNS no lugar do A.Costa (é a sua ambição imediata). https://t.co/WLYCRkJ9Mi"
1397583520499908619,2021-05-26 16:00:51+00:00,"@raquelsofisilva Sagitário- Muito possessivos, ciumentos (embora não gostem de demonstrar), carinhosos quando querem, atenciosos, mau feitio matinal, ego elevado."
1397583304963022849,2021-05-26 16:00:00+00:00,"Graças a Deus nunca sofri de bullying.Mas se há coisa que me deixa triste e revoltado é isso. 
Porque é algo que deve vir de casa, é algo que os pais tenham que falar e ensinar aos filhos o quão mau é fazer isso. 
É revoltante ver um miúdo ser atropelado por causa de sofrer disso"
1397582944710103045,2021-05-26 15:58:34+00:00,@ppaodemonio @Andrefidalgo77 Eu no ano passado estava com essa convicção. Só não gostei do que lhe fizeram este ano por causa de um dia mau que todos têm
1397582919393218565,2021-05-26 15:58:28+00:00,@FragataDiogo @renatarmatoso ai fogo que mau
1397582566471917568,2021-05-26 15:57:04+00:00,hello! (desculpem o mau inglês)
1397581770892234756,2021-05-26 15:53:54+00:00,má influência🤣🤣
1397579894519963650,2021-05-26 15:46:27+00:00,"é a protegerem assim os filhos que eles são como são. 
gurl, a tua filha bateu num miúdo e andava atrás dele p lhe bater mais, isso é bullying e só mostra o mau carácter dela. menos. https://t.co/MVAx9XdVBC"
1397579437839982594,2021-05-26 15:44:38+00:00,"@SexoGratweeto Imagina não ironicamente achar que o Herman José, o melhor actor cómico da sua geração, mau actor. É bastante impressionante"
1397579368696795139,2021-05-26 15:44:21+00:00,"""a minha filha não é má"" ya, a tua filha deu murros no braço do rapaz and almost got him killed. ainda bem que é boa aluna right? ridiculo https://t.co/Cw7lQpIyNk"
1397578946443624451,2021-05-26 15:42:41+00:00,"@SexoGratweeto ""Mas ele (Ricky Gervais) é tão mau ator. Faz um bocado lembrar o Herman, não é? Que faz sempre de Herman. Mas acho o Herman melhor ator do que ele. "" - Pedro ""Eu percebo tótil de humor"" Boucherie"
1397578621674561539,2021-05-26 15:41:23+00:00,"@MassaGris Estás a inferir com cada coisa de uma simples entrevista. Tu não sabes se fez isso só para proteger, se ela é mesmo má mãe, se não ralhou com a miuda em casa. Não sabes nada disso. Mas repito. Fico feliz que saibas as bases de cor. Vais ter bons filhos. Bom dia"
1397578372952334344,2021-05-26 15:40:24+00:00,Cheiro de silicone é mau mas levar com ele 3 horas seguidas esqueceee
1397577790535389185,2021-05-26 15:38:05+00:00,"Meu o puto já estava a chorar, sabem quanto isso é mau.
Se o atropelamento não tivesse acontecido, ele iria se lembrar só de quando a ""amiga"" da turma o pós a chorar a frente do resto da malta.
o bullying não é uma brincadeira, eu sei do que falo
A justiça tem que ser feita+"
1397573863723110408,2021-05-26 15:22:29+00:00,"É um italiano a perguntar, não venho acusar de #almeidismo! Má gestão para sempre dos belgas! https://t.co/23rQj0ZQRu"
1397572488868020225,2021-05-26 15:17:01+00:00,@luis__barros Mt mau mm fds
1397572020326518787,2021-05-26 15:15:09+00:00,"Bullying não é uma brincadeira que corre mal! É algo que dói, traz sofrimento, pode destruir vidas! Não se pode fechar os olhos a este tema. Não se trata apenas de brincadeiras de mau gosto por parte de crianças, trata-se de crianças que crescem a fazer mal a outras!"
1397571960226332678,2021-05-26 15:14:55+00:00,Que tenha só um dia mau do Bernal. E que recupere rapidamente e consiga manter a camisola rosa.
1397571836490170371,2021-05-26 15:14:26+00:00,"@FreyjaSoul É pá só conseguiu ver um erro 😂, já não foi mau."
1397571402350346250,2021-05-26 15:12:42+00:00,"E eu estava mesmo a pensar perder esta etapa para ir estudar 💀
Pelo menos, se tirar má nota, a stora compreende xD"
1397571004176683008,2021-05-26 15:11:07+00:00,"@ArnaoMetello Nem sei que dizer acerca disto... lamento? Sim, lamento. A História, invariavelmente, repete-se, aqui e além. E por norma, a má História 😔"
1397570669299314689,2021-05-26 15:09:47+00:00,Que mau
1397570411844489216,2021-05-26 15:08:46+00:00,"“aquilo foi uma brincadeira” sim, porque eu até vou ensinar ao meu filho daqui a uns anos que bater e fazer pouco das outras crianças é uma brincadeira muito divertida, shame on her, a culpar os outros pela má educação que dá à filha em casa https://t.co/pNd1T2vzlQ"
1397570096583819269,2021-05-26 15:07:31+00:00,@lordjimpt e é necessário fazer alguma coisa para parar esta desconstrução da Humanidade. Nós estamos num caminho muito mau. Por todo o lado surgem movimentos de extrema direita. A corrida aos recursos naturais já começou há muito e duas super potências estão à beira de uma guerra.
1397569865905496067,2021-05-26 15:06:36+00:00,"@JOliveira10_ Completamente sem palavras depois de ouvir isto... Como se o que se passou já não fosse suficientemente mau ainda ficamos com mais certezas da falta de educação da miúda... Acho completamente ridícula esta tentativa de banalizar o sucedido ""Atravessou a estrada sem olhar""... 🤦‍♂️"
1397569859584679939,2021-05-26 15:06:34+00:00,"@dani71342 Disfarça disfarça
Também depois de um bacalhau com natas e latte machiato de caramelo mau era"
1397569144896229377,2021-05-26 15:03:44+00:00,Google search: má vida ou trabalhar?
1397568832844206080,2021-05-26 15:02:29+00:00,"@leofilip95 ""Orelhinhas"" má' lindas 😁"
1397568607287136260,2021-05-26 15:01:36+00:00,"@Guidalopes8 Opa não sejas má cmg , estava a passar bue mal"
1397568157783629828,2021-05-26 14:59:49+00:00,Mas discurso mt mau claro... https://t.co/JfqXMTx6pk
1397568046869454848,2021-05-26 14:59:22+00:00,"que pena o João ter que ter esperado tanta vez pelo Evenpoel e ter tido aquele dia mau,que prodigio que temos no ciclismo"
1397567364313632775,2021-05-26 14:56:39+00:00,"Pior foi quando ela ainda disse « o menino e muito chato, esta sempre a chatear a minha filha e as amigas » Ainda quer tornar a vítima no mau da fita. A feiosa precisava de uma carga de porrada isso sim https://t.co/mhGe71RCzp"
1397567105155977219,2021-05-26 14:55:38+00:00,@pfpvaz Pois tens de começar a ser mais simpática e menos má
1397566304056455170,2021-05-26 14:52:27+00:00,@NodoaNegra É raro dissociar um bully de uma má referência parental. Nas minhas vivências sempre encontrei um justificado pelo outro.
1397566261677133824,2021-05-26 14:52:16+00:00,"Se a filha dela não fosse mal educada, arruaceira e má, não existiria vídeo nenhum. Uma rapariga com 13 anos, já é pré adolescente, é mesmo que não fosse, se soube fazer o mal, é mais que merecido que arque com as consequências e fico extremamente feliz se tiver um castigo pesado https://t.co/qsgevX0kFK"
1397565647488421898,2021-05-26 14:49:50+00:00,@Marc05ilva Está assim tão ma? Ahahahah
1397565421180657670,2021-05-26 14:48:56+00:00,responder com 15h de atraso é muito mau? eu juro que me esqueço
1397564668365967362,2021-05-26 14:45:57+00:00,eu faço tudo pra agradar  e quando falo a verdade sou má.
1397564020736069633,2021-05-26 14:43:22+00:00,"@AnaDoHood Ninguém nasce ""mau"".
Maldade é ensinada, sendo propositada ou inadvertidamente.
Maldade vem da educação dada em casa - ou da falta dela."
1397563545580150790,2021-05-26 14:41:29+00:00,"E quem e que vai ficar ao lado dele quando for vacinado? 
Nao sao as putas do tider nem do instagram. E aquela que teve sempre ao lado dele independentemente de tudo. Mas eu é que sou a ma. Ah e 🤡"
1397562585478844422,2021-05-26 14:37:40+00:00,@FabioWavy @Beatriz32126269 @barata2001 A culpa também é dela sim que com esta idade já sabe muito bem o que é bom e mau. A culpa não é só dos pais
1397562330750361600,2021-05-26 14:36:39+00:00,"@lolfoda_se @cestlaluxure com 13 anos já não pode pensar por ela? podem existir muitas variáveis, mas a falta de noção e respeito pelo miúdo é fruto da má educação, sim"
1397561610999406592,2021-05-26 14:33:48+00:00,"Como assim provas mais concretas? Eles estavam sempre em grupo a gozar comigo, a dizer as cenas mais estúpidas sobre mim, que eu era feio, que não tinha namoradas, que tinha um cabelo horrível, íamos fazer QQ desporto e riam-se de mim mesmo eu não sendo mau naquilo"
1397559564581675008,2021-05-26 14:25:40+00:00,@EmmaBat_ o meu ambiente familiar é que não. atirarem-me do 3º andar poderia ser mau para a minha tendinite
1397558830297489412,2021-05-26 14:22:45+00:00,"Digam-me que este video é editado ou fake por favor, é q isto é mau demais para ser verdade. https://t.co/TfREw1kmMa"
1397558185922289667,2021-05-26 14:20:11+00:00,@atuamelhorfaca @CafiBanido Sim fraca condição económica não implica ma educação educação essa que deve partir de casa a escola deve intervir sim nos casos em que não têm de casa. Portanto acho que a culpa não deve de recair na instituição em si por muito degradada que seja mas sim nos educadores
1397557939620225029,2021-05-26 14:19:12+00:00,"@dpiinho @ruifonseca2626 Isso nao faz dele mau treinador 
Alias o ano passado fomos campeões c aquela equipa...
E nao digas que foi por pelo benfica pq o porto foi campeão c mais de 80 pnts"
1397557174780534791,2021-05-26 14:16:10+00:00,Custa-me concluir q a pandemia será uma fase c a qual se aprendeu pouco ou nada. A ânsia p/ regressar ao business as usual a todos os níveis (e p/ muitos isso ficou arruinado) é desmoralizante. O sistema é mau e desequilibrado mas queremos continuar presos a ele c unhas e dentes.
1397556920773484549,2021-05-26 14:15:09+00:00,@joaodchambel Eu achei graça por ser mau xD mas depois dessas referências todas ahahahah
1397556208140267524,2021-05-26 14:12:20+00:00,"Segundo o ""Ourworldindata"" 5,62% dos japoneses tomaram pelo menos 1 dose da vacina. Ritmo de vacinação tá muito abaixo da Europa e 4 vezes pior do que o Brasil. Japão mostra que má organização não é exclusividade nossa. https://t.co/r4D37JnftE"
1397556169238003722,2021-05-26 14:12:10+00:00,@CarolinaBabo2 Foi muito mau... 🥲🥲
1397554760828477450,2021-05-26 14:06:34+00:00,"@cbaekgu 😔 Bro, só pq eu adiciono mais uns 5 à contagem não precisas de ser má"
1397552292681953285,2021-05-26 13:56:46+00:00,@dpiinho @ruifonseca2626 Mas antes a minha e vejo o fabio cardoso como bom jogador do que a tua que vez o Sergio conceição um mau treinador
1397552067816869889,2021-05-26 13:55:52+00:00,@cryptosbem Bom ranking. Também respeito mais o PCP e o PCTP-MRPP do que todos os outros que meteste por baixo. Sendo que o Chega bem podia estar no Muito Mau.
1397551562185220096,2021-05-26 13:53:52+00:00,Verissimo é tão mau que faz com que este ladrão pareça o Howard Webb https://t.co/BtbrfjJq6T
1397551424481935362,2021-05-26 13:53:19+00:00,"Esta mulher é tão má ou pior que a filha. Se fosse a minha mãe nem falava na TV, ela dava-me era duas estaladas bem dadas na cara e ainda me mandava para uma casa de correção. 
Tenha vergonha, minha senhora, veja a merda que a sua filha é, mas com olhos de ver. https://t.co/rWyh8P0WPT"
1397551209746214913,2021-05-26 13:52:28+00:00,"É uma criança maldosa, com mau íntimo, é pior é a mãe ainda a defender, jamais a minha mãe me ia defender se eu tivesse feito uma merda dessas, não existe desculpas para o que a gaja fez lamento https://t.co/TKwnWHikjc"
1397550951175790596,2021-05-26 13:51:26+00:00,"Acabei de almoçar num restaurante e a comida estava muito boa mas o atendimento foi péssimo. 
Tanto na restauração, como na fotografia, o produto pode ser muito bom mas se a experiência for má, os clientes não voltam nem recomendam."
1397550917709357058,2021-05-26 13:51:18+00:00,"@Mbento00 Eu sei, e espero, e nem é uma queixa. Decidiram assim para as autoimunes graves que não estavam na lista de doenças que seriam mais perigosas para doentes covid-19, seja. Mas não admito que acusem Lisboa de um tratamento especial quando isto acontece. É demagogia e da muito má."
1397550825598296064,2021-05-26 13:50:56+00:00,Confiança a mais dá sempre um mau resultado
1397549475208605701,2021-05-26 13:45:34+00:00,"@_ifvf_ @tasaarderohmano inês, achas que é uma forma saudável de crianças de 13 anos distinguirem o bom do mau, através do ódio? achas que é por terem 12 mil pessoas a chamarem lhe nomes e a desejar mal a família dela que ela vai aprender? só a ia tornar pior"
1397549407860662275,2021-05-26 13:45:18+00:00,@OAngeloVoltou @maldsuado É tropa do meu pai o gajo não é má pessoa só era lampião 🤣
1397549279665741825,2021-05-26 13:44:48+00:00,"@gustofrodrigues E isso, porque se ele não for à escola, entra na estatística e a escola começa a ficar com má fama. Porém, querer saber do bem-estar e sucesso no futuro dos alunos, para eles, já não é do encargo deles. Além disso, eu ainda não entendo como é que em pleno 2021 ainda deixam... +"
1397549048681349121,2021-05-26 13:43:53+00:00,"@andrefp19 @themendesxp não são, mas acredita que és muito limitado pelo que és. E mesmo nesse caso, a criança não têm culpa de ter nascido com um ""mau"" cerebro, right?"
1397548048373399561,2021-05-26 13:39:54+00:00,"Relativamente ao caso de bullying: é importante não reduzir a análise a um caráter unilateral e estender o processo de vitimazação até aos agressores, é importante não cair no viés cognitivo de acreditar que existe o lado bom e o lado mau. Nenhuma análise deve ser tão simplista."
1397547787903021056,2021-05-26 13:38:52+00:00,“A morte fetal deu-se por falta de monitorização electrónica contínua da frequência cardíaca fetal.”Má ideia está moda “cool” de fazer o parto em casa! Um parto por mais natural que seja acarreta riscos e deve ser  feito num hospital .  https://t.co/gUyAl9myoW
1397546897439694851,2021-05-26 13:35:20+00:00,"@famadadepressao Não é mau jogador na minha opinião!! Erra é muito na decisão!!
Mas se me disserem assim: ""segundo o jornal O Jogo Pêpê deve continuar em Famalicão"" ficava mais contente! 😂"
1397546009891426307,2021-05-26 13:31:48+00:00,"@zerofixemano @paulojorge01973 @laraneto71 @babalu12_ Tou me foder sem 13 anos !!! Achas que e com falinhas mansas que isto se resolve, vai la tu dizer olha n facas isso que é mau achas que ela vai te ouvir ??? Ya ela diz sim eu paro paro, 5 min dps ta a fzr o mesmo."
1397545990228516875,2021-05-26 13:31:43+00:00,@ma_tildee SIM PFF
1397545936113610758,2021-05-26 13:31:30+00:00,"@JoaoJoana11 eu não acho o gajo mau, só que eles podiam ter ido buscar malta um pouco melhor do que o que foram. perderam jogos teoricamente fáceis porque não lhes apeteceu jogar"
1397545904656289801,2021-05-26 13:31:23+00:00,"cada vez estou mais afastada das pessoas, e não sei até que ponto isto pode ser mau… mas sinceramente já não consigo estar comigo mesma"
1397545607225618434,2021-05-26 13:30:12+00:00,@ma_tildee aquilo da corrente elétrica resistividade e isso
1397545528368508930,2021-05-26 13:29:53+00:00,Dormi 10 horas desde domingo kk visto q hoje é quarta não está mau
1397545331257225218,2021-05-26 13:29:06+00:00,@ma_tildee estava mesmo a espera que visses este tweet
1397544845477130255,2021-05-26 13:27:10+00:00,"@generala Juro.te que esta miuda e os seus paizinhos iam sofrer...

A mae da agressora a pedir a outra que não fale mal da sua filhinha que ela é grande e nao é má !!!!

Ela simplemente está a dizer a agressora que ela nao fez nada de mal."
1397544704053596161,2021-05-26 13:26:37+00:00,"Ver comentários de portugueses no facebook é ganda má ideia, vivemos mesmo num país retrógrado, racista, xenófobo, homofóbico, etc… Às vezes dá mesmo vontade de emigrar"
1397544331796430855,2021-05-26 13:25:08+00:00,"@smalldwarf8 E a cena do ""se o prof te der uma chapada, chegas a casa e ainda levas mais"" eh eh... Exageros e excepções à parte, havia algum respeito pela profissão de professor, e não a pura má educação e comportamento que hoje em dia se vai sentindo por todas as escolas..."
1397544012886724614,2021-05-26 13:23:52+00:00,@ogcadu 😭😭😭😭 mano isso é bue mau mas tem piada
1397542891002765319,2021-05-26 13:19:24+00:00,"Atirar responsabilidades aos pais de crianças com mau carácter é fácil, difícil é imaginar se fosse convosco. Posto isto, nunca iria à televisão expor ainda mais uma filha minha mesmo que fosse em defesa (porque os pais realmente defendem os filhos de tudo)."
1397541641938997257,2021-05-26 13:14:27+00:00,acabaram mm de me dizer que a biblioteca do is*te é má? se fossem à da fcsh nunca mais diziam uma barbaridade dessas
1397541576176553984,2021-05-26 13:14:11+00:00,"@Elchaldas Alterei pq eu próprio percebi que estava má, podes continuar a achar cringe mas assim penso estar mais correto ahahah"
1397541535252627456,2021-05-26 13:14:01+00:00,"@Leonelgros1 Ainda não vi onde é que eu aí tou q dizer que se és hetero não podes falar, ou falar de homofobia... se te empenhasses tanto na escola como te empenhas a defender homofóbicas não tinhas uma compreensão de texto tao má"
1397540725395533824,2021-05-26 13:10:48+00:00,Tou bue de mau humor hoje
1397540618075840512,2021-05-26 13:10:23+00:00,"Minha querida, continua a dar essa educação que das, a tua filha fez merda, e devias assumir o erro dela e fazer perceber que é uma má pessoa e que tem que haver consequências . Garanto que se fosse meu filho não deixava que as coisas ficassem assim. https://t.co/8faQVZsYxB"
1397539784273317892,2021-05-26 13:07:04+00:00,Tv portuguesa é tão má… que vergonha alheia on God https://t.co/eGTyoA9DZ5
1397539222496714752,2021-05-26 13:04:50+00:00,Já que jogasse 30 segundinhos já não era nada mau 😅
1397539200770220038,2021-05-26 13:04:45+00:00,Mau dia para te chamares Jéssica
1397538847702069259,2021-05-26 13:03:20+00:00,@barbara4gomes eu quando recebo as coisas com má qualidade também não consigo dar más reviews e dou tipo 3/4 estrelas 😭
1397538374823682054,2021-05-26 13:01:28+00:00,"@aapnsousa_sousa Ok. Admito que li a correr. Desculpe. O que eu vejo, com amigos q são pais, é uma total e talvez inconsciente desculpabilização do comportamento dos filhos.N são todos assim mas a grd maioria é. Alguns com mto mau resultado. O dinheiro ñ compra nem compensa tudo."
1397537499229171714,2021-05-26 12:57:59+00:00,"@_ferrao09 olha, nada má ideia 🤣"
1397536618853109766,2021-05-26 12:54:29+00:00,"@desentranhada @CatarinaCoutin3 Errado! Punição é castigo! Eu fui punido(castigado) pelos meus mais atos ao longo da minha infância e juventude. Seja com proibições ou em casos mais graves à base da chinelada e isso não me fez mau nenhum. Fez-me aprender que se eu tenho um mau comportamento, serei castigado... https://t.co/1N4JqdstCh"
1397536182880415745,2021-05-26 12:52:45+00:00,"@inesamaislinda Eu percebo o que tu queres dizer mas é normal as pessoas virarem-se contra ela. Foi ela que provocou aquilo. Há pessoas que têm essa maldade com elas, pode ser sim, por algum transtorno ou episódio na vida delas que as leva a isso. Mas é muito mau. +"
1397536113091350539,2021-05-26 12:52:28+00:00,"@jonasnuts @sissacc Sim, mas ter essa reacção com uma miúda de 10 anos é cruel.
Por mais que esteja num mau dia."
1397535498969784320,2021-05-26 12:50:02+00:00,@_maryslino_ @inspiredf1 @angiebackagain Isso é bue mau pq eu nao recebo notificações. Achei tóxico. Mas ao menos cheguei a tempo
1397535385220169729,2021-05-26 12:49:35+00:00,"@a_john @EmbaixadorN @AFN1982 Posso dar exatamente a mesma educação aos meus filhos mas não posso esperar que os meus filhos tenham exatamente a mesma personalidade e carácter. Um pode ser ""bom"" e o outro ser ""mau""."
1397535113257398272,2021-05-26 12:48:30+00:00,@rodrima1976 Má educação essencialmente.
1397534889990410244,2021-05-26 12:47:37+00:00,"COMO TEMOS SENADORES OPORTUNISTAS E DE MÁ FÉ ,E PÉSSIMA ÍNDOLE , É ESSE AZIZ !👇👇👇ISSO É QUERER MATAR À POPULAÇÃO !NEGACIONISTA ! https://t.co/8co8pHfL1q"
1397534051737776132,2021-05-26 12:44:17+00:00,@jesuisfangueiro Ser como tu já é mau que chegue
1397533814440833034,2021-05-26 12:43:20+00:00,@anabeladantas @HBO Que série incrível! Já não me aguento de ansiedade para o final
1397532681848729601,2021-05-26 12:38:50+00:00,"Sofram as consequências deste tipo de atitudes merdosas e os pais destes deviam ter vergonha por ""educarem"" imbecis deste género.
Não há lição nenhuma a tirar disto a não ser que existe gente mesmo muito má. Nojento."
1397532653197352962,2021-05-26 12:38:44+00:00,@PedroMNFerreir Eu diria que era tudo mau.
1397531656169435141,2021-05-26 12:34:46+00:00,@idk_maybexx Não foi muito mau
1397530565247709189,2021-05-26 12:30:26+00:00,@NunoFerro9 @HelenaMota9 Tive direito a essas todas. E o óleo de fígado era em xarope para ser mesmo muito mau
1397529469477326851,2021-05-26 12:26:05+00:00,"Nikita Parris pela Vivianne Miedema, o Arsenal era muito burro se o fizesse e nem é pela Parris ser má, muito pelo contrário, mas a Miedema é a Miedema! Se estão para trocar a Miedema assim, a melhor solução era a Carolina Mendes  https://t.co/Insx0pir5i"
1397529238182449156,2021-05-26 12:25:09+00:00,"""eu durmo pronto pra guerra e eu não era assim
eu tenho ódio e sei o que é mau pra mim
fazer o que se é assim, vida loka cabulosa"""
1397529192602996741,2021-05-26 12:24:59+00:00,"Mandei vir uma pizza, fui buscá-la à porta do prédio, conclusão, a porta de casa fechou-se e fiquei na rua, sem telemóvel, sem chave e descalço
Mas pelo menos tinha pizza, nem tudo é mau"
1397528895092572164,2021-05-26 12:23:48+00:00,@_twiterdoguinho @AntivirusPlay @azevedokas @aquilamattos Exato. A todo momento eles dizem que a vila é velha. Não é mau imaginar que falte sempre água.
1397527469461282818,2021-05-26 12:18:08+00:00,"@swtdanii muito mau, eu na tua posição tinha abandonado na hora ou tratava a mal"
1397527331267305473,2021-05-26 12:17:35+00:00,"@guidapreis @joaomiranda @IsabelQ40635325 @joxventura 2,8% de analfabetismo para quem nasceu entre 1946 e 1951 tendo em conta o que vinha de trás não é mau. Dentro disto muitas destas pessoas não deverão ter acabado a primária, mas a em ler e escrever"
1397527086252838913,2021-05-26 12:16:36+00:00,"@laranjabraza Agora chegas ao 81 e arrumas as botas ahahahaha.
Olha tbh se isso fosse verdade nem sei até que ponto era mau."
1397526699462508546,2021-05-26 12:15:04+00:00,"Esta malta do MEL são todos fascistas. Eu ainda estava na dúvida. Hoje ficou comprovei que são fascistas, amam ditaduras, gostam de Salazares, esperam que haja Golpes Militares e Aceitam o Racismo, a má educação e quem sabe o Bullying e Homofobia.

Eu digo NÃO a esta Direita."
1397526380162830337,2021-05-26 12:13:48+00:00,"@IdeiasII @saogama @NatliaPinto2 @luisferreira_47 @esquilo71 @palmiralucas8 @HerminioCoelho4 @HerminioCerq @lfilipe_moreira @buk3http @LourencoNatalia @jasenascedragao @TarecaPlantier @levycorreia @lepetitportcord @MariaGa07881096 @NormaFe71774279 @hmarianeves @HelenaMota9 @236vmf3 @meneses_nela @pitabelmonte @BarreiraCecilia @FranciscaTeodo3 @AnaMira90992386 @antoniovieirag4 @AlpioCustdioLop @isabecarve @FatimaAntero @Prince_x007 @nuno_ivo @dmcoelho51 @HFormiguinhas @IvanildoFranc19 @IsabM @DionisioThereza @nelasilva @Teresa86066883 @AnaCatarinaOrt @Aluisbio @Colleenella @RuiFrancoSilva @AntnioLopes20 @dealmeidaperei2 @NicolinaGuim @miguelj85434039 @s Bom dia Ferreira e todos, hoje estou de muito mau humor...☕️😍🙋‍♂️"
