1396233033154547712,2021-05-22 22:34:30+00:00,0 pontos é muito mau
1396233032483450897,2021-05-22 22:34:30+00:00,Tenho pena do Reino Unido. Não foi assim tão mau. 0 pontos dos 2 lados.  #Eurovision
1396233027907379203,2021-05-22 22:34:29+00:00,"nossa, que mau"
1396232933044854794,2021-05-22 22:34:06+00:00,"Ui, Reino Unido isso está mau  #Eurovision"
1396232845601955840,2021-05-22 22:33:45+00:00,QUE MAU
1396232813817499652,2021-05-22 22:33:38+00:00,"@Adriana_Az27 @SedimentedGeist gostar da finlândia e da itália não é mau gosto, é muito bom gosto 🥲"
1396232784339951617,2021-05-22 22:33:31+00:00,@bruna_meireles3 @aquariana1994 @ma_tildee Olha o respeito miuda
1396232690853101568,2021-05-22 22:33:08+00:00,"sim os juris têm mau gosto, percebemos

#Eurovision"
1396232416004558848,2021-05-22 22:32:03+00:00,@alexahpc That's funny ahah foi um mau ano mesmo ahah
1396232226916941824,2021-05-22 22:31:18+00:00,@Fabiommrib Nem tens noção do quão mau
1396232189029855243,2021-05-22 22:31:09+00:00,"Estou a brincar, não está mau mas não curto dos Clippers"
1396232091478732801,2021-05-22 22:30:46+00:00,"7º lugar do juri não é nada mau, de todo! #Eurovision #POR"
1396232043378487301,2021-05-22 22:30:34+00:00,A atuação do Reino unido foi assim tão má?
1396232022247583745,2021-05-22 22:30:29+00:00,"@manelsalsas @joaomiranda @pismael @jmedeiros71 Nunca fui pró rankings nem mesmo enquanto fui professora. O que eles dizem não me interessa, seja bom ou mau, quero ver com os meus olhos e a análise faço-a eu . O sistema de avaliação está uma fantochada há anos ."
1396231819134124032,2021-05-22 22:29:41+00:00,Para pontuação do júri não está mau Portugal #Eurovision
1396231786930266114,2021-05-22 22:29:33+00:00,Para agora estamos em 7' nada mau!
1396231786313785349,2021-05-22 22:29:33+00:00,Portugal em 7° até nem é mau
1396231771579158531,2021-05-22 22:29:29+00:00,Opah top 10 já não é mau mas fds merecíamos mais
1396231725806768133,2021-05-22 22:29:18+00:00,#eurovision Portugal em 7º no juri. Nada mau para quem nem ia passar à final.
1396231723009073153,2021-05-22 22:29:18+00:00,"@fabiosilvaaaa @Muito_irRITAnte Foi mau, mesmo 😬"
1396231094916222976,2021-05-22 22:26:48+00:00,@nislfp26 É que não é má mas não quero que ganhe pá
1396230799800905729,2021-05-22 22:25:38+00:00,"@JCS3110 prefiro oq enviaste pelo wwp, mas esta tbm n tá má &lt;33"
1396230547584819204,2021-05-22 22:24:37+00:00,"@ToxicityAcute @12Landim Ma o que é que umas coisa tem a ver c/a outra ?!Por amor de Deus ,apenas disse q por cavalheirismo e cortesia era o homem que deveria pagar sempre,ms isto é uma OPINIÃO!!imaturas e inseguras são as pessoas que não respeitam opiniões alheias e agem cm se fossem os donos da razão."
1396230444543270916,2021-05-22 22:24:13+00:00,111 pontos não é nada mau para esta altura
1396230278184591362,2021-05-22 22:23:33+00:00,"eu nao percebo um caralho disto, mas se o reino unido nao tem um unico ponto aquilo deve ter sido muito mas muito mau"
1396230131044261889,2021-05-22 22:22:58+00:00,"Pra quem não sabe, eu comecei a ser são paulino por causa da minha vó, e nos ultimos anos com a má fase do time, sempre que eu ligava pra ela, a gnt falava sobre o time e ela smp dizia ""não se preocupa filho, logo a gente volta a ser campeão como antes"" e isso durou por anos +"
1396229989452984320,2021-05-22 22:22:24+00:00,cada vez acho mais que sou mesmo má
1396229712142376962,2021-05-22 22:21:18+00:00,"@o_reixanas @anasilvabros Sim, dessa música nem vale a pena falar ahahah eu não estou a dizer que a música é má, é linda, mas pronto"
1396229539504828421,2021-05-22 22:20:37+00:00,"O Reino Unido continua com 0. A música era má mas porra, coitados"
1396229360827445254,2021-05-22 22:19:54+00:00,@romeu 10 da Islândia. Já não é mau
1396229061970644997,2021-05-22 22:18:43+00:00,"Bulgaria não é mau, gostei"
1396228800585904130,2021-05-22 22:17:41+00:00,"@ManonBluts Nice, retro music by them a lembrar os Abba. Nem vi que musica a Irlanda levou nas meias finais. Foi assim tão má comparando com as usual musics da golden decade(em termos de wins) de 90?"
1396228456560668674,2021-05-22 22:16:19+00:00,O Reino Unido não foi assim tão mau… 0 pontos? Coitados 🤭 #Eurovision
1396227906800603141,2021-05-22 22:14:08+00:00,Mau é ter que abdicar de uma coisa para ter outra
1396227791562186752,2021-05-22 22:13:40+00:00,@toomuchmin 80% da música é voila não 😭 tipo não é má mas há bem melhores
1396227646749618187,2021-05-22 22:13:06+00:00,"@lopesgm1 Normal com a subida divisão, não? Demasiado mau se não tivesse acontecido 🤣"
1396226794852962307,2021-05-22 22:09:43+00:00,Fds o pessoal tem tão mau gosto
1396226586853220355,2021-05-22 22:08:53+00:00,@_diogo_delgado_ nao sejas mau :/
1396226559967641610,2021-05-22 22:08:47+00:00,@rmartins024 Não é má de todo comparada com a da Islândia meu ahahah porra
1396225559194181633,2021-05-22 22:04:48+00:00,"Queria perceber o que viram na atuação da Suíça. Nada contra, mas foi mau 😬 #Eurovision"
1396225507184848898,2021-05-22 22:04:36+00:00,Epá...os Kelly Family é muito mau
1396225182461833220,2021-05-22 22:03:18+00:00,"Espanhóis só dão 5 pontos a Portugal?, má vizinhança e o que da"
1396225153487548418,2021-05-22 22:03:11+00:00,"@selecaoportugal @joaofelix70 @Atleti Cambada de aziados
Foi igual com o Renato, tudo o que veste vermelho neste país é mau 
Parabéns João pois foste uma peça fundamental ,quem diz que não é quem não viu os jogos !"
1396225079902621724,2021-05-22 22:02:54+00:00,@JoannaAzevedo Foi muito mau
1396225015209734146,2021-05-22 22:02:38+00:00,Estes gajos têm todos mau gosto
1396224556122116102,2021-05-22 22:00:49+00:00,a suíça é bué má lamento
1396224422575476740,2021-05-22 22:00:17+00:00,"A da Suíça não era má, mas tipo :l"
1396224258506989570,2021-05-22 21:59:38+00:00,A música da Suíça foi tão má não entendo
1396222912496115712,2021-05-22 21:54:17+00:00,Mau demais para ser verdade ! https://t.co/6rc6GFoMVK
1396222643506978816,2021-05-22 21:53:13+00:00,"A música de Itália da Eurovisão devia virar o hino da adolescência lá poiché tutti gli adolescenti sanno fuori di testa, ma diverse da loro. Que ganhe a boa música no festival das vaidades e para adolescentes mas que muito boa gente gosta de ver e não tem mal nenhum apesar de ser"
1396222527391903747,2021-05-22 21:52:45+00:00,"@Lsfazenda AI SOCORRO JÁ ME ESTÁ A DAR UMA COISINHA MÁ, TANTO TEMPO"
1396222347510784004,2021-05-22 21:52:02+00:00,@suffernandes Sou bipolar. Pura e simplesmente ficam a olhar para mim a achar que é tudo mau feitio
1396222250983084032,2021-05-22 21:51:39+00:00,@ma_tildee Os EUA a Eurovisão? 🤔😂😂
1396221056063520769,2021-05-22 21:46:54+00:00,@lilflowxr tou ma cagar😟😟😟
1396219259949305856,2021-05-22 21:39:46+00:00,"a Heroes era má em 2015, era má em 2017, é má agora, vai ser má para o ano..."
1396219198389559299,2021-05-22 21:39:32+00:00,Não foi um mau ano para o Real. Tudo bem que não ganharam nenhum troféu mas pelo menos garantiram a qualificação na Super Liga Europeia
1396219074343022598,2021-05-22 21:39:02+00:00,@miguelalex23 um pirete faço eu à música. tão mau
1396218882445164545,2021-05-22 21:38:16+00:00,"@ajessicamiranda Já dá para teres uma ideia do que é bom, do que é mau e do que é realmente péssimo 😂"
1396218848861466624,2021-05-22 21:38:08+00:00,@Caneleiras Mau! Não precisa de me chamar gorda AI!
1396218788723494921,2021-05-22 21:37:54+00:00,@luiscoelho23 Esta e particularmente má mas há mais dimensões idênticas
1396218639892815877,2021-05-22 21:37:18+00:00,"@taty_martins Tipo não quero parecer má, mas é tudo demasiado Pop e até houve uma que me fez muito lembrar a última que venceu...
Devo dizer que a que gostei mais foi a de Itália (não pondo Portugal na equação)."
1396218605881241609,2021-05-22 21:37:10+00:00,"@wtvcenas CENAS tá mau, dm"
1396218453409808387,2021-05-22 21:36:34+00:00,"Vi agora o apanhado e isto é tudo muito mau, credo #Eurovision"
1396218357066747904,2021-05-22 21:36:11+00:00,"@GoncaloIlharco Fui semi má, não teve intenção"
1396218231929647106,2021-05-22 21:35:41+00:00,"@tarantelma Tu e os Maneskin 😄
Também gostei da Lituânia, não tanto da Islândia e, claro, MA MA MA MATA HARI 🇦🇿"
1396218033010585600,2021-05-22 21:34:54+00:00,"@mariaescaja Escapaste ao clube. O que é sempre bom e mau em simultâneo, que os concertos devem ser do caraças! 😬Muitos parabéns!"
1396217685692850177,2021-05-22 21:33:31+00:00,@Andrelima0705 Eu sei. So estava a querer dizer que não acredito que benfiquistas vão festejar uma taça numa epoca tao má como esta.
1396217620546916352,2021-05-22 21:33:15+00:00,"contra os lampiões nada deste tipo deve ser considerado má educação, nojentos de merda https://t.co/IRjF5Zx6qD"
1396217435611619331,2021-05-22 21:32:31+00:00,Vamos confiar que é um dia mau e não uma fase má
1396215815393980418,2021-05-22 21:26:05+00:00,@ritadmendes2171 bem não podia ser tudo mau
1396215712264376327,2021-05-22 21:25:40+00:00,Tudo é mau na música!
1396215611806654467,2021-05-22 21:25:16+00:00,Olivia Rodrigo não tem uma música má...
1396215592542162948,2021-05-22 21:25:12+00:00,@l00l741 P fzeu lembra ma bh ka ta
1396215086352637954,2021-05-22 21:23:11+00:00,@der_terrorist Uma estupidez. Os desgracados dos pequenos comércios e restaurantes não aguentam outro mau Verão
1396214522529173513,2021-05-22 21:20:57+00:00,"Previsão para Portugal, que nem está nos meus favoritos: Ficará entre o 10º e o 15º lugar (o que até não é um mau resultado)."
1396214333940674567,2021-05-22 21:20:12+00:00,"@taty_martins Sim, marca pela diferença... Não é radiofónica se é que entendes.
Não que ser radiofónica seja mau, mas acho que a Eurovisão necessita de originalidade"
1396213442625802240,2021-05-22 21:16:39+00:00,Isto foi muito mau. Coitada da Sia #Eurovision
1396213135653146624,2021-05-22 21:15:26+00:00,"“Siamo fuori di testa, ma diversi da loro”, se isto não é a melhor língua de sempre, por amor de Deus... #Eurovision"
1396212616100515846,2021-05-22 21:13:22+00:00,@akilestroia Eu disse ‘em mau’ 😊😊
1396212395056504840,2021-05-22 21:12:30+00:00,@mlopes Basta ver que não tem grandes problemas com os sindicatos.... é o indício que é muito mau
1396212009486671874,2021-05-22 21:10:58+00:00,"Os portugueses que desejam que os Mambas tenham uma má classificação, estão ao nível dos que destilam ódio ao Ronaldo só por ser formado no Sporting. Depois venham falar-me de patriotismo. RIDÍCULOS"
1396211885935050752,2021-05-22 21:10:28+00:00,@Argon6_ @_barbari_ Foi ao nível das melhores canções dos black eyed peas mas este ano. Não é má mas foi muito do mesmo
1396211667399286784,2021-05-22 21:09:36+00:00,"Resumindo, é tudo mau."
1396211606304944128,2021-05-22 21:09:21+00:00,@nicasdodrip sou bué mau pra ti kkkkkkkkkk
1396211370010550273,2021-05-22 21:08:25+00:00,"Juro eu não quero ser mau, mas a única música que consegue competir com o TUGAO é a francesa, as outras são uma grande merda tbh"
1396210919152160770,2021-05-22 21:06:38+00:00,"@daniaamm_ Não acho má, mas serem favoritos acho exagerado!"
1396209558146535426,2021-05-22 21:01:13+00:00,"@MSMag16 @Apeteceume Tiveste com o @R33Rocha e o Quim, tb n tiveste uma má tarde 😛"
1396209337610215424,2021-05-22 21:00:21+00:00,Alerta CM: Troca de insultos entre dois jogadores do Benfica. Mau ambiente no balneário? https://t.co/qVjUjLedR4
1396209194429304836,2021-05-22 20:59:46+00:00,"O BOM DE TER UM DIA MAU com Dra. Clara Pinho
#RisoVital #MedicinadaVida
@apaulavital @RisoVital
INSCREVA-SE 👉https://t.co/8kn1XCbEpL
#obomdeterumdiamau
#viveravida #emocoes #stress #medo #dordaperda #sindromedadadorahumana  #alegria #clinicaariadne #manuelacerejeira #clarapinho https://t.co/ZhhRfIOrev"
1396208863276326916,2021-05-22 20:58:27+00:00,"@wilsonbduarte Itália é tão má, não aceito"
1396208770959749128,2021-05-22 20:58:05+00:00,"@luicchi @EuSouZarolho @pach211 Ou até o Irão ir lá cantar e em vez de fogo de artificio rebentarem uma bomba de mau cheiro, e ganharem."
1396208760515874819,2021-05-22 20:58:03+00:00,@pauloacecilio É tão mau que devia ser The Weekday
1396208253676179458,2021-05-22 20:56:02+00:00,Que dia bom e mau :/
1396208199854968834,2021-05-22 20:55:49+00:00,"#SWE Epah, não sei, não cativa, não tem nada assim que o destaque. Não é mau, de todo, apenas não fez o click #Eurovision"
1396208107462725633,2021-05-22 20:55:27+00:00,"@diogomrtns2 SIAMO FUORI DI TESTAAAAAAA MA DIVERSI DALOROOOOOOOOO AAAAAAAAAAAA

Se eles ganharem eu e a Giovanna choramos abraçados"
1396208073988050944,2021-05-22 20:55:19+00:00,"Crise climática tão má, que quando tiver dinheiro suficiente para ir, o nível do mar já as engoliu https://t.co/D3opZmkKHY"
1396207729589510147,2021-05-22 20:53:57+00:00,"@Bandeirinha_13 Mano era fazer falta ali, e a cena de gastar os 10 sgundos e muito mau fds"
1396207155657809920,2021-05-22 20:51:40+00:00,"@Veronica25356 Mm fds, a minha sorte é q é abeira da escola ent n é tão mau, venho cm a Inês á escola e ta feito"
1396207073751339009,2021-05-22 20:51:21+00:00,A MÚSICA DE ITÁLIA É TÃO MÁ! COMO É QUE ISTO ESTÁ EM PRIMEIRO??? #Eurovision
1396206512884830209,2021-05-22 20:49:07+00:00,A da Holanda não é má. #Eurovision
1396206426196951040,2021-05-22 20:48:46+00:00,"@Lsfazenda a música não é má de todo, mas por acaso não gostei muito da voz"
1396206417439248384,2021-05-22 20:48:44+00:00,"#NED Não compreendo a cena toda em torno dele. Ok claro que o homem tem uma voz muito boa mesmo, mas a música não acompanha nesse sentido, pelo menos eu não acho. Não é má, mas não compreendo o público todo a delirar 🤷‍♂️ #Eurovision"
1396206288703524869,2021-05-22 20:48:14+00:00,senhor da holanda....damn ma
1396206164568952834,2021-05-22 20:47:44+00:00,"A Eurovisao este ano tem 2, 3 músicas boas, depois tens a Ucrânia...
Tão mau
Eu a todo o momento estava à espera de um dropp para uma batida de rave mas não.
Eu achava que para a Eurovisao só iam músicas isto é demasiado mau."
1396205800880840704,2021-05-22 20:46:17+00:00,"@KintasKing Já te mandaram para o caralhinho hoje ? … 
Que mau 😠 https://t.co/FlFjDe5qUr"
1396205290127872002,2021-05-22 20:44:16+00:00,"Noruega, nem sei o que dizer.
É que tá muito mau...
#Eurovision"
1396205118866001923,2021-05-22 20:43:35+00:00,@beatrizdias_18 eu tou no Porto mas tou smp ctg ma já sabes 🤞
1396204199688474630,2021-05-22 20:39:56+00:00,@Ma_rii100 Mesmo!!!
1396203620153139203,2021-05-22 20:37:37+00:00,"OMG AQUI VEM ELA, GAYS PREPAREM SE PARA MÁ MAMAMAMAMAMATA HARI  #Eurovision"
1396203534123687944,2021-05-22 20:37:17+00:00,Má escolha de imagens 😅 https://t.co/fxugNNhcj9
1396203242317623297,2021-05-22 20:36:07+00:00,Como e que é possível uma estrela como o Giannis ser TÃO mau nos FT e demorar tanto tempo para lançar? Ultrapassa me
1396203227260100610,2021-05-22 20:36:04+00:00,"Depois de tanta má música seguida, a música da França é como aquelas bebidas para limpar o palato.

#Eurovision"
1396203160763576324,2021-05-22 20:35:48+00:00,"Pode ser um bocado mau, mas às vezes ir à praia ou simplesmente ver fotos de outras raparigas no insta sobe a minha auto estima, não estou tão mal assim, apesar de continuar na merda 🤣"
1396203061958299656,2021-05-22 20:35:24+00:00,OH MALHA MA MA MALHAO *DROP*
1396203050214297600,2021-05-22 20:35:22+00:00,"Dizem que o confinamento fez bem ao processo criativo e à arte em geral.  O festival deste ano parece-me, de facto, menos mau."
1396203031780339712,2021-05-22 20:35:17+00:00,"Não foi a senhora deputada que ficou um bocado confusa com algumas perguntas naquela entrevista viral? Isso sim foi ignorância, ir mal preparada para uma entrevista. Quanto ao Rocha, bom ou mau é humor e não ignorância. https://t.co/qoQbKZBLmm"
1396202498625613827,2021-05-22 20:33:10+00:00,Esta música é tipo açúcar: é mau mas estou viciada #Eurovision
1396202489045786630,2021-05-22 20:33:08+00:00,A da Ucrânia é tão tão tão má
1396201260873830403,2021-05-22 20:28:15+00:00,"Esteve aqui ao pé de mim e ninguém me avisou.

Má onda presidente. https://t.co/DQbpDrGQWf"
1396201089716924421,2021-05-22 20:27:34+00:00,@carregabenflca Vão perder pelo mau jogo dele. Bastava ele fazer um jogo aceitável e os Heat ganhavam
1396200863862083586,2021-05-22 20:26:40+00:00,"A música do ano passado dos The Roop era a minha favorita de todas, merecia ganhar! Esta não é má, também gosto bastante, mas não é a mesma coisa #Eurovision"
1396200779820814338,2021-05-22 20:26:20+00:00,querem comparar quantos anos de diferença tem o futebol feminino do Sporting do Benfica? ahahahah que comparação má https://t.co/AI7rAqxr4p
1396200748388601865,2021-05-22 20:26:13+00:00,"@mitioritos mehhh nao é ma, mas tambem nao é assimmmmm"
1396200739458932736,2021-05-22 20:26:11+00:00,Essa gaja tem cara de professora de educação física que é má 😂😂 https://t.co/xd7MTkAr9k
1396200690238771203,2021-05-22 20:25:59+00:00,Que má disposição
1396200206719492104,2021-05-22 20:24:04+00:00,"Nada mau, Bulgária. #Eurovision"
1396199979018899457,2021-05-22 20:23:09+00:00,O SNS é feio e mau https://t.co/n9l3if5Oar https://t.co/ZQOWF1jnA1
1396199914351247366,2021-05-22 20:22:54+00:00,@oTiagoDavid Mau que dói.
1396199848655867906,2021-05-22 20:22:38+00:00,@manuel_fontao A Alemanha não é má mas os islandeses ainda são melhores
1396199617629499404,2021-05-22 20:21:43+00:00,@JorgeAHenriques Eu gosto do Guardiola e do Simeone sou um felizardo! Dizer que um treinador de sucesso como Simeone é um mau exemplo é tão absurdo! 🤦‍♂️
1396198684048642048,2021-05-22 20:18:01+00:00,"@ninamiranda25 Exato, Opa a do uk nem era assim tão má, mas o james newman tava mt nervoso e a prestação não foi nada de especial. Se estes não fossem obrigatórios estavam na final muitos países que mereciam mt mais"
1396198664457043969,2021-05-22 20:17:56+00:00,"@LuisCoelho51 Não estou dizer que só há 1 fórmula para o sucesso.
Estou a dizer que não gosto da proposta dele.
Se todos pensarem que esse é o caminho para o sucesso, ficamos todos a perder.
Para mim é um mau exemplo do que deve ser o jogo."
1396198137660850177,2021-05-22 20:15:50+00:00,"a #FIN vem SEMPRE com isto, não muda 😧 mas o refrão não é mau #Eurovision"
1396198136251551752,2021-05-22 20:15:50+00:00,@JorgeAHenriques Mau para o Futebol é pensar que só existe uma maneira de obter o sucesso.
1396197838346932227,2021-05-22 20:14:39+00:00,"@LuisCoelho51 Eu estou aqui.
Não gosto da proposta de jogo.
O resultado não influencia a minha análise.
Espero é que outros treinadores não sigam este exemplo. É mau para o futebol."
1396197703042969600,2021-05-22 20:14:07+00:00,"A música da Alemanha não é má de todo, mas envolve um ukulele, o que vai de encontro aos meus princípios #Eurovision"
1396197610004832256,2021-05-22 20:13:44+00:00,@ogajo_ Só que em mau
1396197476571484162,2021-05-22 20:13:13+00:00,O sotaque dele é tao mau que parece que do nada ele está a falar alemão
1396197316420321282,2021-05-22 20:12:34+00:00,@HMPW07 @The_one_happy @pvscruz @asilva_ch O manafa o zaidu e o nanu os tres juntos n fazem um lateral de jeito. Mau demais
1396197191685967873,2021-05-22 20:12:05+00:00,@joana_bboficial Má energia vai vai.... Boa energia vem vem 🙌
1396197049310253056,2021-05-22 20:11:31+00:00,Isto é muuuito mau
1396197036920352772,2021-05-22 20:11:28+00:00,"@ultrarealismo Bro quiseram ser independentes, se achas Vizela assim tão mau e “aldeia” até devias estar feliz por ter acontecido assim"
1396196176899280903,2021-05-22 20:08:03+00:00,@inesvicente ya não era má mas aquela dança e aqueles pianos teclados opa ahahahah
1396196155315339269,2021-05-22 20:07:58+00:00,"Tentei hoje pintar em vidro pela primeira vez, até não ficou tão mau 🤣 tentar melhor na próxima vez 💪

#AttackOnTitan #Levi #anime #glasspainting https://t.co/K4krbplwYG"
1396196126802550792,2021-05-22 20:07:51+00:00,@dorythefixe Miúda má do camp rock... Mt bom
1396195570298114052,2021-05-22 20:05:38+00:00,"#ESP Ai o meu coração não aguenta 😍 a música é boa, a voz idem, é ele é todo um pedaço de mau caminho 😏😍 https://t.co/4nvUPgv3sG"
1396195030235222018,2021-05-22 20:03:29+00:00,espanha isto é uma beca mau
1396193531346264064,2021-05-22 19:57:32+00:00,Ou eu fiz alguma coisa mesmo muito má noutra vida ou alguém me rogou uma praga enorme
1396192357519867908,2021-05-22 19:52:52+00:00,Esta actuação da Grécia é inacreditavelmente má. Como é possível isto ter chegado à final? #Eurovision
1396192305019772934,2021-05-22 19:52:40+00:00,@vtf__sff So de estares a fazer com pistola já e mau
1396192211092578312,2021-05-22 19:52:17+00:00,kkk a Grécia e tão má que é boa #Eurovision
1396191895097954307,2021-05-22 19:51:02+00:00,"É só um mau dia não uma má vida, foca-te 🍀"
1396191345207828480,2021-05-22 19:48:51+00:00,@TelmoFe Mas em mau 😬
1396191311854768135,2021-05-22 19:48:43+00:00,"Nem queria ser má, mas se desse para dar pontos negativos à música do reino unido eu dava #Eurovision"
1396191309359108097,2021-05-22 19:48:42+00:00,A música do Reino Unido também é má. Ainda bem que eles pagam para ir diretamente à final #Eurovision
1396191288668610561,2021-05-22 19:48:37+00:00,@raquelongras A música até não é má... mas uhhhhh 🥲
1396189881181814790,2021-05-22 19:43:02+00:00,"@nadsssc Ik, problemas pessoais e otus kzs ta complica vida d tudo alguem. Porém nsa odja uns minis ta passa um imagem d ma curso eh um cou tanto quanto impossível d fazi, sendo k tem txeu k ta larga ses responsabilidades."
1396189508991913987,2021-05-22 19:41:33+00:00,A música portuguesa é a menos má juntamente com a belga. E sendo simpático.
1396188808954228738,2021-05-22 19:38:46+00:00,"QUE COISA LINDA, AMO-TE POR AMOR TATANKA, DESCULPA TUDO DE MAU QUE DISSE SOBRE TI #Eurovision"
1396188729061134337,2021-05-22 19:38:27+00:00,@Jotacrl Porra muitoo mau
1396188497623633937,2021-05-22 19:37:32+00:00,@leofilip95 Ele canta que que farta! Acho mau colocares isso 😪
1396187613191622656,2021-05-22 19:34:01+00:00,A música da Malta nem sequer é má mas porem anúncios na internet para votarmos neles é baixo #Eurovision
1396187451895517190,2021-05-22 19:33:23+00:00,o chamado mau de perder á tripeiro enjoy the 3rd https://t.co/UPrZ5LvZRs
1396185721870995459,2021-05-22 19:26:30+00:00,@andrefmarquess E achas mau?? Eu faço trabalhos de universidade e nem lá ando
1396185083304988675,2021-05-22 19:23:58+00:00,"@ultrarealismo Rio Ave, precisamos de um campeonato forte e o Rio Ave faz falta na I Liga, teve uma época má sem dúvida."
1396185009598435331,2021-05-22 19:23:40+00:00,"A Bélgica não é má, mas não me aquece nem arrefece, é bom mas não passa disso #Eurovision"
1396184896964546565,2021-05-22 19:23:13+00:00,a música de Israel chamar-se “set me free” é a ironia de maior mau gosto que já vi #Eurovision
1396184605313622018,2021-05-22 19:22:04+00:00,@beaaghostinho Não sejas má já estão há anos se bem qd era  puto n percebia porquê Israel....
1396183857708290048,2021-05-22 19:19:06+00:00,"Sempre soube que ficasses para a vida, nunca pensava que fosse com má imaginem"
1396183468913135619,2021-05-22 19:17:33+00:00,Manutenção garantida. Menos mau.
1396183447706738693,2021-05-22 19:17:28+00:00,@diogocavaleiro É má. Eu amo
1396183241015631877,2021-05-22 19:16:39+00:00,"@Adapto5 @ojeconomico Utópico não será necessariamente bom, também poderá ser mau, que é o caso de tudo o que venha do BE."
1396182547701370883,2021-05-22 19:13:53+00:00,@Shyznogud @fcancio As escolas públicas não podem selecionar os alunos à entrada nem expulsá-los por mau comportamento ou más notas.
1396182479342555142,2021-05-22 19:13:37+00:00,@pmcoelho Desculpa mas isto não é recalcamento. É mesmo mau carácter.
1396182347209482240,2021-05-22 19:13:06+00:00,@AnaLuABC Mas em mau
1396182150999851013,2021-05-22 19:12:19+00:00,"SAD do FCP q reestruture modelo de contratações fora da formação B.
Hulks de contrafacção,Igor Cássios, tudo muito mau.
Não se escondam só atrás das horríveis arbitragens q nos perseguiram,mas se não fosse Evanilson e outros da A,teríamos descido.Reconheçam erros e melhorem"
1396182129357336576,2021-05-22 19:12:14+00:00,Ma vai aonde queriam que eu fosse comentarista do culto hj kkkkkkk
1396181948083671042,2021-05-22 19:11:30+00:00,A minha mãe diz que eu tenho mau olhado e o pior é que eu acredito
1396181919646224387,2021-05-22 19:11:24+00:00,O mau perder é algo que realmente está embutido na cultura do FC Porto.
1396181521271336960,2021-05-22 19:09:49+00:00,"@costahugo3424 Bem, e como se chama o central? Tambem é muito mau."
1396181289460506626,2021-05-22 19:08:53+00:00,"@FCPorto Muito mau. Com oito jogadores da equipa A, não conseguimos sequer empatar."
1396180668158291979,2021-05-22 19:06:25+00:00,"Pois isso é que é muito mau..
Parece que ainda vive na pré história..
Por isso a 🐞o incomodava tanto 😞 https://t.co/jQGOuJFO07"
1396179932720599052,2021-05-22 19:03:30+00:00,O Irobiso é tão mau
1396179539890425860,2021-05-22 19:01:56+00:00,Não gostar nada de gente mal educada e arrogante 🤝 passar a vida de mau humor e cara trancada pq uma coisa não tem nada a ver com outra
1396179517090287620,2021-05-22 19:01:51+00:00,@ritadsteles @madalenaccarmo_ @catarinafolv e é mau ?
1396179405488205827,2021-05-22 19:01:24+00:00,"Nem tudo é mau ao menos o Vilafranquense foi pá terceira divisão, adeus até amanhã 🙂"
