1396110654411583488,2021-05-22 14:28:13+00:00,"Se o Benfica não ganhar ao Porto agora, vai ser muito mau"
1396109130339860483,2021-05-22 14:22:09+00:00,@MestreTeu Pode ser que empatem hoje. Já não seria nada mau.
1396107397849100290,2021-05-22 14:15:16+00:00,@andreiia_nova Muito mau 🤦‍♀️
1396105909252890626,2021-05-22 14:09:21+00:00,PUTAAAA FINALMENTE UM FERRARI MA POLE
1396105859734847488,2021-05-22 14:09:10+00:00,Leclerc você é mau 🤣
1396104642745016320,2021-05-22 14:04:19+00:00,Não consegui ver a qualificação mas como assim o Hamilton ficou em 7. Esteve assim tão mau?
1396104386884026370,2021-05-22 14:03:18+00:00,"verstappen na primeira linha, já não é mau"
1396104292793208838,2021-05-22 14:02:56+00:00,"É preciso ser mau, foda se"
1396104223952195586,2021-05-22 14:02:40+00:00,O Lando em P5 nada mau podia ser pior
1396103935153352712,2021-05-22 14:01:31+00:00,"@LiliJSequeira 😒

É mau, admito"
1396102413581524994,2021-05-22 13:55:28+00:00,"aiai se o meu papá me diz que eu não posso ir sair ele é mau, mas quando é para lhe pedir 20€ já não reclamo. Se ainda não fores independente financeiramente, eles têm sempre a palavra final. Vocês acham que a vida é mm um conto de fadas ou sei lá"
1396102003495997441,2021-05-22 13:53:50+00:00,"@GuedesHenrique0 Jogos completamente diferentes, mau era se não festejassem o empate no dragão"
1396099641423409159,2021-05-22 13:44:27+00:00,Mais uma má qualificação do Ricciardo
1396098872070520843,2021-05-22 13:41:24+00:00,@dunkle___nacht Pronto como prefiro mulheres altas a baixas vou ser opressor fetishista e má gente
1396097901680594949,2021-05-22 13:37:32+00:00,@carlotaebasta Não sejas má para mim :/
1396097882550202372,2021-05-22 13:37:28+00:00,"Wait esta proposta não é de todo má, censura não é fixe, lá porque alguém não é comuna não quer dizer que mereça ser censurado, nunca pensei dizer isto mas tou do lado dele desta vez, a proposta é boa. https://t.co/oS0vR94D9W"
1396097788715360257,2021-05-22 13:37:05+00:00,@maanddas NEEEE  foi exatamente oq eu pensei. A minha mae queria indicar a minha cabeleireira (que é especialista em cachos) mas era bue má onda estragar o negócio a cabeleireira kkkkkkk
1396097521672409088,2021-05-22 13:36:02+00:00,"Tsunoda muito mau, mais cedo vai ser despedido https://t.co/zb6eHZIgRo"
1396097258278559751,2021-05-22 13:34:59+00:00,@rmorgadoo Está Mau isso 😂
1396096696711630848,2021-05-22 13:32:45+00:00,Deus esta me a dar mais uns tempos porque sabe que quando tiver mota mato me😂😂
1396095721644961792,2021-05-22 13:28:52+00:00,"@LuisCoelho51 E é, principalmente tudo o que se passa fora das 4 linhas que faz com que seja muito ma"
1396094960550690820,2021-05-22 13:25:51+00:00,"@MariaCordRosa @drzodiacus Não sabes, mas a Jorbi é mesmo uma marca portuguesa. Do Sul. Outra coisa que também não sabes é que a malta de Rio Tinto deve ficar bastante ofendida ao serem acusados de mau gosto… por alguém de Almada ou la o que é. Mas eles que se defendam ;)"
1396094762437038080,2021-05-22 13:25:04+00:00,@alesawn As de hoje tá normal.. Na casa da Simona a net não é tão mau
1396094117357162497,2021-05-22 13:22:30+00:00,@i_melosampaio Nunca utilizei. E o motivo foi vários episódios a que assisti no Aeroporto de Lisboa com mau tratamento dos passageiros.
1396093129325957120,2021-05-22 13:18:34+00:00,@andre_fcporto Abstenho porque já conto com má arbitragem em todos os jogos do Porto...
1396092655541571585,2021-05-22 13:16:41+00:00,@SavateNaFinal Obrigado mau feitio 😃❤️
1396092277823578113,2021-05-22 13:15:11+00:00,@Pintter1 Bem já que falas nisso não era uma má ideia já vimos que raparigas só nos partem o coração porque não testar coisas novas ahaha😗
1396092072260784128,2021-05-22 13:14:22+00:00,"Sou mau a matemática, mas consigo dar te o valor que mereces"
1396091969756143618,2021-05-22 13:13:58+00:00,"Mazepin é tão mau que consegue ficar a 1,6 segundos do Latifi🤣🤣"
1396091119407149064,2021-05-22 13:10:35+00:00,Que atitude tão má
1396091073123045377,2021-05-22 13:10:24+00:00,O jesus chorar a lesão do lucas como se não fosse culpa da má gestão dele é só incrível
1396090971213926401,2021-05-22 13:10:00+00:00,"@yazidesulemane Obrigadíssimo pela resposta completa, Yazide.

Percebo que este tipo de terminologia é pouco estabelecido e sujeito a má interpretação.

Se não for abuso: qual é o termo que a comunidade religiosa e cultural ocidental islâmica usa para identificar a ideologia política em causa?"
1396089822394081285,2021-05-22 13:05:26+00:00,"Não vou ser má, há conexões que pode passar os anos que passar que nunca vão deixar de existir, pode ser por maus motivos mas vão la estar a atormentar-vos a vida."
1396089522639757321,2021-05-22 13:04:14+00:00,@_19jep06_ se fosse tipo 6 milhões nem era mau...
1396089450267136001,2021-05-22 13:03:57+00:00,Devo de ser mt mau
1396088823164121090,2021-05-22 13:01:28+00:00,"“Andava malparado e sem saber, nesta história
Se é obrigatório que ela chegue ao final
Pra todo o mau bocado que vier à memória
Há sempre um argumento que o faz ser bom”"
1396087854544080896,2021-05-22 12:57:37+00:00,"@NelioLeao1 @inesdealmeida90 Estamos há um ano com o país fechado para não disseminar um vírus, em horas juntam-se milhares sem regras e não acontece nada? As vezes ver o mundo além da bola não era mau."
1396086567828078595,2021-05-22 12:52:30+00:00,@sporting_tatico isso é mau?
1396085321499037697,2021-05-22 12:47:33+00:00,Tenho a certeza que eu a raúl fomos vítimas de mau olhado esta semana
1396084373498253320,2021-05-22 12:43:47+00:00,Meu a Olivia Rodrigo nao e ma mas acalmem essas hormonas
1396084057432371202,2021-05-22 12:42:31+00:00,A minha mãe é mesmo má influência
1396083318299496450,2021-05-22 12:39:35+00:00,"Deitaram mau olhado à minha família, tenho a certeza"
1396083021963530240,2021-05-22 12:38:25+00:00,@LeitoraCompuls2 Verdade! Para compensar o mau 2020
1396082944557649924,2021-05-22 12:38:06+00:00,"@ltavaresbravo O crescimento económico é mau para as eleições...
É preciso manter o povo na pobreza e revoltado contra o Estado e as empresas para garantirem a sua base eleitoral."
1396080593402728449,2021-05-22 12:28:46+00:00,"@LionQueen_7 *plot twist vou deixar a má vida e virar menino da igreja*
*PLOT TWIST SOU DROGADO NÃO VOU NÃO*"
1396080475668615172,2021-05-22 12:28:17+00:00,"@trainmaniac Mas achas que alguém no governo diz não ao AC? Nem pensar que o menino é conhecido pelo seu mau feitio para quem lhe diz não. Excepção feita ao Pns, que o costa lhe deu carta branca"
1396080103147327490,2021-05-22 12:26:49+00:00,"@CratoNuno Conclui-se que como já todos sabíamos foste o pior ministro da educação da nossa história, pois os resultados de hoje são consequência da tua gestão. Conclui-se também que para além de mau ministro és mau carácter ao tentar sacar algo de bom pra tua imagem de um ranking como este"
1396080058041782274,2021-05-22 12:26:38+00:00,"Já no que toca a letra daninha, vê como a lenda caminha
Mando p'a caminha a tua zona, até se for a me'ma q'a minha"
1396079992526737412,2021-05-22 12:26:22+00:00,"Conclui-se que como já todos sabíamos foste o pior ministro da educação da nossa história, pois os resultados de hoje são consequência da tua gestão. Conclui-se também que para além de mau ministro és mau carácter ao tentar sacar algo de bom pra tua imagem de um ranking como este https://t.co/bEAAd28PoS"
1396079459015528451,2021-05-22 12:24:15+00:00,Agora percebo te Joana. Oh my... isto é tao mau. 😅 #bbtvi https://t.co/olRiayzY1w
1396079373955084291,2021-05-22 12:23:55+00:00,@byb_gang Gps ma’am 👀
1396078371973607429,2021-05-22 12:19:56+00:00,"@bancadadeleao Sem retirar mérito a nenhuma delas, as CPIs são inúteis, servem apenas para expor  os trambiqueiros, mas não terão consequência para além de desmascarar uns quantos artistas. Já não é mau, mas sabe a pouco"
1396077765603078144,2021-05-22 12:17:31+00:00,"@areaslb Vinagre não parece ser má opção, não é tão bom a atacar como o Grimaldo mas muito mais completo e bem mais jovem"
1396077728164634625,2021-05-22 12:17:22+00:00,@AnaCatarinaOrt Alguém deveria ir preso pelo mau gosto. Que atentado!
1396077103041372164,2021-05-22 12:14:53+00:00,Eles tiveram tempo e dinheiro de sobra pra fazer...agr brave girls tendo em conta o pouco dinheiro e tempo....não está assim TÃO mau. Os 3 são feios? Sim. Mas não são horrorosos.
1396077058221019139,2021-05-22 12:14:43+00:00,@Lydiaitai No ma’am
1396075484291682307,2021-05-22 12:08:27+00:00,E como sempre fico como a má da fita
1396074734836649990,2021-05-22 12:05:29+00:00,"Acordei bem e puseram me de mau humor, mais um dia normal portanto"
1396074455781216259,2021-05-22 12:04:22+00:00,Mau humor do crlh fds
1396071066460639232,2021-05-22 11:50:54+00:00,"Talvez eu seja complicado
Talvez me queixe mais do que eu digo obrigado
E tenho muito ao que brindar, ou talvez seja qualidade
Ser tão volátil e andar entre bom e mau
É prova de que eu sou real"
1396070657394450435,2021-05-22 11:49:17+00:00,"A única parte má é o dormir sozinha, odeio dormir sozinha"
1396070268867653633,2021-05-22 11:47:44+00:00,@IuriGotFacts é suposto ser mau? https://t.co/tQ2Apj8M6R
1396069799873204226,2021-05-22 11:45:52+00:00,"Como uma vez disse o maior político da história desse país Renan FUCKIN Calheiros:
""Temos de julgar mas não podemos ser mau"""
1396069473745051650,2021-05-22 11:44:34+00:00,@peepergirl oh e achas mau
1396068415337533441,2021-05-22 11:40:22+00:00,era muito mau uma filha não gostasse dos pais 🤦🏼‍♀️ https://t.co/jn5qPGl1ja
1396067379566845952,2021-05-22 11:36:15+00:00,"@f_arantes2k2 percebo, se calhar foi um effort da tua parte de agradar a quem não valia a pena. das minhas turmas de secundário também não tenho queixas - de uma livrei-me depressa e da outra vou mantendo contacto de longe a longe, portanto já não está mau xD"
1396066072709812226,2021-05-22 11:31:04+00:00,"@NevetonFg28 @JorgFaria @JoaoMarques1906 Tu és muito burro 😂
O kDB tem golo? É por isso que é mau?"
1396065749509320705,2021-05-22 11:29:46+00:00,ressaca tá mt má porra
1396064085066797057,2021-05-22 11:23:10+00:00,"@_i_lowkey @bom_mau_villao Não comes?
Comes, com jeitinho comes"
1396064079857557507,2021-05-22 11:23:08+00:00,É tudo mau no futebol português. https://t.co/LUvUJJiUsD
1396064072521617414,2021-05-22 11:23:07+00:00,@xinesmx Ele era muito mau
1396063914035716096,2021-05-22 11:22:29+00:00,A colheita de 1966 nem foi assim tão má! Tenham um #DiaFeliz 🎉😄 https://t.co/cwqfDaMGcC
1396063785278971907,2021-05-22 11:21:58+00:00,Tens mau gosto Klopp sem dúvida alguma😆 https://t.co/30HiabDwAd
1396063421242777601,2021-05-22 11:20:31+00:00,Ja me conseguiram meter de mau humor pqp
1396062907566333956,2021-05-22 11:18:29+00:00,"@O_Saloio Mau, queres guerra? É com 1 Z!"
1396061747690328065,2021-05-22 11:13:52+00:00,@danielmarqs07 @pedro47afonso Não sou má só retribuo os elogios que o rapaz me dá Olhaa
1396061678014447619,2021-05-22 11:13:36+00:00,"@DffdrDk @guerri @HEN1 Mentira, vieram forte sim, assisti todos os jogos do plano e posso dizer que não jogaram nada contra triumph, extra salt,etc. Falhando tiros faceis, má comunicação, etc... Mas eles jogam pelo hype, e contra a furia tem hype de sobra, quase não os vi a falhar tiros"
1396061576948375554,2021-05-22 11:13:12+00:00,"@_angelinav @pedro47afonso Tu és mesmo má fogo, coitado do rapaz"
1396059053399420932,2021-05-22 11:03:10+00:00,"O Haas é tão mau meu deus, o Mick não fez erro nenhum, a traseira do carro do nada foge..."
1396058518743044098,2021-05-22 11:01:03+00:00,@academiacr7 @DiogoAD Claro que não também mau era levantarem tanto a crista assim
1396058320226693123,2021-05-22 11:00:15+00:00,"Primeiro dia a conduzir e ainda não bati, nada mau ahha"
1396056087602909187,2021-05-22 10:51:23+00:00,Ter medo de me apegar e me fdr  por culpa do passado é tão mau.....
1396055866152005632,2021-05-22 10:50:30+00:00,N queria que fosse assim queria que me dizes tudos os sentimentos que tens por mim seja bom o mau eu queria saber
1396054100983300103,2021-05-22 10:43:29+00:00,"Já é mau, mas só o facto de se lol 😂 https://t.co/AZhm8z0sj4"
1396050803673141251,2021-05-22 10:30:23+00:00,vir ao ginásio a um sábado foi uma má ideia
1396050592481611777,2021-05-22 10:29:33+00:00,"@fazatuaegira Ganda ma onda!! Não é o cão que está mal, é o dono"
1396050203778617345,2021-05-22 10:28:00+00:00,"@LoucosPeloSCP se fosse tipo 6 milhõeszitos... já não era mau para suplente, mas 15 fds...🤦🏻‍♂️"
1396049343212359683,2021-05-22 10:24:35+00:00,Estou a ficar de mau humor
1396049271225466884,2021-05-22 10:24:18+00:00,@abrodrigues63 Bom dia Antoninho e longe vão os dias de mau descafeinado heh. Dia maravilhoso para ti
1396048289401909248,2021-05-22 10:20:24+00:00,@Charliesmc2812 @drzodiacus Ela não é má. Apenas bloqueia demasiado no Twitter.
1396046851992870916,2021-05-22 10:14:41+00:00,Boy nunca vi gajo com tão mau feitio como ele
1396046724527972353,2021-05-22 10:14:11+00:00,@sergiolavos Bastante mau mas n é nenhum PS
1396046379001294851,2021-05-22 10:12:48+00:00,"O bom de já estar a exame é não ter de fazer este orçamento horrível, o mau de estar no exame é não poder ser avaliado a fazer este orçamento"
1396045406254075912,2021-05-22 10:08:56+00:00,"@Lusa_noticias Priceless
""Em declarações por escrito à Lusa, o ministro referiu que as classificações dos alunos dependem de diversos fatores “que não têm qualquer relação com a ação da escola”.""

Para ele, que a escola seja boa ou má, professores de qualidade ou não, depende só do aluno"
1396045351413600256,2021-05-22 10:08:43+00:00,"@karlus Priceless
""Em declarações por escrito à Lusa, o ministro referiu que as classificações dos alunos dependem de diversos fatores “que não têm qualquer relação com a ação da escola”.""

Para ele, que a escola seja boa ou má, professores de qualidade ou não, depende só do aluno"
1396044087904636934,2021-05-22 10:03:42+00:00,"Mano 
O senhor
Amor
Lindo
Querido 
Anjo
Deu me 18 no monologo da ma
I love this man"
1396043321810771969,2021-05-22 10:00:39+00:00,@PORDATA E isso é bom ou é mau...?
1396042232017338373,2021-05-22 09:56:19+00:00,"@FranciscoMarkes Agora mais a sério, parece-me de muito mau tom este tipo de conteúdo n ? Obviamente as duas são falta, não me parecem existir dúvidas … agora tentar colar que por uma n ter sido a outra tb n devia ser… profissional de comunicação, certo ???"
1396041936608374787,2021-05-22 09:55:09+00:00,@danieltome171 @TiagoIsidoro eu sou um bom mau exemplo
1396040316919164928,2021-05-22 09:48:43+00:00,"@inesmalia14 Assim, não fui mau só ficou torto 😂"
1396040251190153220,2021-05-22 09:48:27+00:00,O argumento habitual de quem é a-favor-de-qualquer-coisa-má. https://t.co/uwon6KSR0V
1396036645296672774,2021-05-22 09:34:08+00:00,acordar e levar logo com má disposição é smp ótimo 🙄
1396035207665528837,2021-05-22 09:28:25+00:00,"@BrunoFigueiredo sim. como se fosse possível desactivar um terminal destes em menos de ano e meio. é tudo demasiado mau, até me sinto mal a pensar nisto"
1396034586933616641,2021-05-22 09:25:57+00:00,Não foi tão mau quanto pensava
1396033959910383617,2021-05-22 09:23:27+00:00,@AnaCatarinaOrt Não gosto. Muito mau.
1396029910146244608,2021-05-22 09:07:22+00:00,Como é que a Lola vem aqui e olhamos uma para a outra e rimos da cara uma da outra é pq foi mau ontemmmm😂
1396029678419431426,2021-05-22 09:06:26+00:00,"@observadorpt É triste quando o discurso não é quererem pautarem-se pelo melhor mas sim pelo mau que existe! É a típica atitude do PS em tudo, ficar no mau! Assim nunca chegamos ao excelente. Que triste ser português"
1396028214611480580,2021-05-22 09:00:37+00:00,"Sempre hn obi flado ma tempo é dinheiro, mas tmb smp hn obi flado ma família sta em primeiro. ✍🏾"
1396028102283776010,2021-05-22 09:00:11+00:00,A juiza queria é que lhe fizessem o mesmo para ver se mudava de opinião https://t.co/TkQlLSYiOY
1396024802083811330,2021-05-22 08:47:04+00:00,"@soffuuuG ia bué mau linda :( no meu nnc aconteceu isso, mas tmb nnc mais tiro e já tenho desde 2018 🤨"
1396022808912834560,2021-05-22 08:39:09+00:00,"@manjos Não me parece mau, ser ""pouco parasitas""."
1396022282179555330,2021-05-22 08:37:03+00:00,"Estive fora do Instagram durante 8 meses. Sigo 278 contas. 
Ou o Instagram sabe que não tenho interesse em ver fotos de pratos e de praia ou o algoritmo desta merda é mesmo mau. https://t.co/nKT8VUCKNj"
1396022019460943872,2021-05-22 08:36:00+00:00,@lopesdaniela17 Não é assim tão mau
1396021622931431425,2021-05-22 08:34:26+00:00,Dei mau jeito às costas logo hoje 😪
1396019194609680385,2021-05-22 08:24:47+00:00,"Cortaram me Palma de Maiorca, mas Açores não tá nada mau mesmo 💯"
1396017736590020608,2021-05-22 08:18:59+00:00,"Eu ando sempre de cara trancada, mas não é por ser má, é só vício 😂"
1396015091661819904,2021-05-22 08:08:29+00:00,"«(...) como é evidente, os rankings não servem para qualificar as escolas per se. A posição absoluta ou relativa que cada escola ocupa nos rankings não nos dá informação objetiva se é uma boa ou má escola ou uma escolha melhor ou pior do que outra.»"
1396012073021231104,2021-05-22 07:56:29+00:00,tou bue de mau humor calem se
1396008415760113666,2021-05-22 07:41:57+00:00,@maddmuvs Realmente! Mau não é
1396005978831835139,2021-05-22 07:32:16+00:00,"@JoanaBizarro Ainda bem, às vezes temos que experimentar o mau, para dar valor ao bom 🙂"
1396004778925301767,2021-05-22 07:27:30+00:00,"o meu Messi faz anos
eu fui lhe dar os parabéns toda feliz e ele fez um ""MIAAAU"" feio e mau para mim :("
1396004496317329408,2021-05-22 07:26:23+00:00,"@Manu1503 Já para não falar da (má) idiotice que é, quando um estrangeiro entra de carro em Portugal..."
1396003275401568256,2021-05-22 07:21:31+00:00,"@CorsinoSarah Mau feitio pro Bono , e pro Edge , já agora"
1395989915528269826,2021-05-22 06:28:26+00:00,eu nunca dou a minha opinião sem ma perguntarem. só no twitter
1395988958845227009,2021-05-22 06:24:38+00:00,Os de má vontade podem ter com o cramunhão.
1395988857359904768,2021-05-22 06:24:14+00:00,@paulo_baldaia @OscarRi24786736 Concordo! Esse argumento que é usado de aumentar as notas no privado é a forma de tentar esconder a má qualidade do ensino no público.. A resposta aos jornalistas do Tiago Brandão Rodrigues e a prova de que algo não está bem..
1395981278357381120,2021-05-22 05:54:07+00:00,"#NowPlaying JOÃO TAMURA - A MARIA REMIXADA por Pedro, o Mau ( chill dark sexy electronic experimental new school amor slow )"
1395980777888825345,2021-05-22 05:52:08+00:00,"@Calcanhar_Viena Fdx, aquilo está mesmo mau. Será que o Vieira já não vai reestruturar a dívida?? 😎😎"
1395979774707830784,2021-05-22 05:48:08+00:00,Acordar ás 6:30 da manhã a um sábado é mau demais
1395972207847919619,2021-05-22 05:18:04+00:00,"@europintas O Sporting foi tomado de assalto e o Frederico foi a smentinha do mau no balneário e não só! Infelizmente os Sobrinhos, Alves, Ferreiras e entre outros vão conseguir acabar com o Sporting!"
1395966740715249672,2021-05-22 04:56:21+00:00,"@JuskoCardoso mas ele ao menos faz o trabalho dele, passa e defende muito bem
ate pq se viu hoje q ele não tem confiança p isso, aquele último lançamento do jogo foi muito mau, e era p ganhar"
1395952419532689408,2021-05-22 03:59:27+00:00,"Aquele lançamento do green mds é tão mau, eu acho que foi pior lançamento que já vi fds"
1395951680525672452,2021-05-22 03:56:30+00:00,@_brunofonseca16 Sou má influência 🥱
1395941005438955520,2021-05-22 03:14:05+00:00,"@celinettpb @lovelyshyz acho a vc ta na sua má fase tb celine, miruda do caralho"
1395935759488765954,2021-05-22 02:53:14+00:00,@carlos_jb_paz Se for escaldão não é mau. Pior é se for com a variante Indiana n. 2...
1395933945175359490,2021-05-22 02:46:02+00:00,"Eu não queria dizer que isto está mau, mas está!!! Faz me lembrar quando eu me mascarava no carnaval e achava que estava igual ao quer que fosse mas NAO ESTAVA!!! https://t.co/sD88RV9KIX"
1395928779747377153,2021-05-22 02:25:30+00:00,Amo o facto de me terem consigo por de mau humor depois de uma noite destas...🥱
1395922415981563905,2021-05-22 02:00:13+00:00,Sou assim tão má pessoa ?
1395919102573699074,2021-05-22 01:47:03+00:00,Não quero ser má mas Olivia querida devias mesmo ter ficado apenas pela drivers license
1395917121826197505,2021-05-22 01:39:11+00:00,Tenho um mau pressentimento 😬
1395916128095031296,2021-05-22 01:35:14+00:00,"@r0driguez_18 Kz eh pa ka ser obrigatório, es ka fla ma eh pa caba ku serviço militar"
1395912996988272652,2021-05-22 01:22:47+00:00,"@SavateNaFinal Fou fugir de ti, és uma má influência. Xau"
1395910846744875009,2021-05-22 01:14:15+00:00,Governo do Maranhão multa Bolsonaro por não usar máscaras e provocar aglomeração no estado | Maranhão | G1 https://t.co/FMmcQtyKpc
1395907563796025346,2021-05-22 01:01:12+00:00,"@jenifervcastro És má 😂😂😂😂, tadinha"
1395904359272263682,2021-05-22 00:48:28+00:00,"Podem me chamar feio,arrogante mas se dizem que tenho mau gosto musical lutamos juroo 😒😭"
1395902518983602185,2021-05-22 00:41:09+00:00,"A sério! Estar cansado fisicamente é mau, mas estar cansado psicologicamente é foda"
1395898731225026561,2021-05-22 00:26:06+00:00,@the_sawisthelaw @nsouatuamae Se forem das novas até nem está nada mau
1395898498420285451,2021-05-22 00:25:11+00:00,"@BraisDoval A má hóstia constante dá passo à má hóstia intermitente. Ganha-se peso porque o corpo se nutre melhor (fumar causa má absorção). Sonhar com cigarros vai desaparecendo, depois é só 1 vez por ano. E cada vez um se dá mais conta da merda que era. Eu levo 7 anos, ânimo e paciência!"
1395898342509527040,2021-05-22 00:24:34+00:00,"Se ja é mau assim imagina se ele tivesse tik tok, eu pedia pra ir para adoção. https://t.co/OJZVUEIc6g"
1395897025246515200,2021-05-22 00:19:19+00:00,"Tas sempre metida em tudo 
Mas não és ninguém 
Passaste a ser uma bad bitch 
Ma só te mando um go Fuck your self"
1395896799362224129,2021-05-22 00:18:26+00:00,porque é que é tão difícil alguém se apaixonar por mim? sou assim tão má comparada a elas?
1395894759076597764,2021-05-22 00:10:19+00:00,Mano o gajo dá para mau e depois mete um vídeo da Tatiana ? Bro wtf https://t.co/wIWWEXnMlC
1395893045380456450,2021-05-22 00:03:31+00:00,@LittleBastard48 Má escolha de nome
1395892056711745541,2021-05-21 23:59:35+00:00,Se eu fizesse o mesmo já era o mau da fita
1395890720725217283,2021-05-21 23:54:16+00:00,"@not_unamuno Quando um é mau, qualquer que venha depois tem de ser pior, caso contrário não merece o nome 😉"
1395888305368178692,2021-05-21 23:44:41+00:00,"@fxkking Individualmente foi mau, mas ganhamos então Yha 🙏🏾🙏🏾❤"
1395887986726916096,2021-05-21 23:43:25+00:00,"E anda muita gente distraída! Quando resolvem divulgar a lista das “grandes golpadas” que, sendo de calibre igual ou superior, estão esquecidas no BES “mau”? Catunas, Saraivas e correligionários.... Também estamos a pagar esses! https://t.co/GZndSBVQHy"
1395887863288504326,2021-05-21 23:42:55+00:00,@biclaranja @CratoNuno Porque se nota e’ má o melhor é não fazer testes!
1395887536325726208,2021-05-21 23:41:37+00:00,@CratoNuno Concluir-se que se avaliação é má então o governo desvaloriza e descredibiliza a avaliação! Simples! Uma vergonha este ministro!
1395887064856637442,2021-05-21 23:39:45+00:00,"@putowillyy @LilacAnimacoes willy, pensa, fundamenta, exprime.
o melhor que podias fazer nesta ocasião era só admitires que disseste merda em vez de insistires o contrário, para além do lilac estar certo, nem ouviste e já foste logo dizer que é mau, e tu não és burro, o que tu disseste foi."
1395886421458702341,2021-05-21 23:37:11+00:00,@ma_tildee toma ai o teu trigger https://t.co/J3Y0r43fsF
1395886149546217473,2021-05-21 23:36:07+00:00,"@GuilhermeSWLK @andre_andrelipe @Adrianastica @Sem_NomeXD @theumilk99 Ele gosta de pandas, não deve ser má pessoa"
1395885922051399681,2021-05-21 23:35:12+00:00,@Kelvin1893_ @Gustavo24290962 @brunoandrd Nessa capa o Record até acertou em 66% das contratações. Nada mau...😉
1395885915038420994,2021-05-21 23:35:11+00:00,"Parte da torcida do vizinho do 4° lugar tentando apontar racismo no apelido ""piruca"" só comprova o que estamos dizendo a algum tempo. Essa gente é canalha demais, baixa, sórdida, mau caráter.

Piruca | Israel e Rodolffo | #IsraeleRodolffo"
1395885564751142912,2021-05-21 23:33:47+00:00,Bue mau ter sons com alguém kkkkkkk agora n ouço os sons só pra n lembrar dessa pessoa
1395885034947686403,2021-05-21 23:31:41+00:00,Digam me um (1) álbum mau do cálculo. Só um
1395884351351664646,2021-05-21 23:28:58+00:00,"@Elmano_sadino Têm mt. Há  gente c mt calo q n se deixa levar p/ gente simpática (n é o meu caso), mas n é fácil. Tb corre mal. Fui voluntária. P/ser má avaliadora é q sp percebi q o lugar certo era de moderadora de adopções. Colocava pessoas e associações em contacto ou associações entre elas"
1395882115091337218,2021-05-21 23:20:05+00:00,Eu tenho uma má sorte do crlh
1395881853224210433,2021-05-21 23:19:02+00:00,"@rochahateyou Fica antes tu no teu canto mano, inventas paí as tuas histórias porque a miúda não tem de ficar com má fama só porque a vossa cena nao deu, segue com a tua vida e vai contar mentiras po crlh"
1395881760370606080,2021-05-21 23:18:40+00:00,@brunix_s Tão mau assim tmb não
