1397157351757594625,2021-05-25 11:47:25+00:00,prevejo um dia horrível
1397155830366101514,2021-05-25 11:41:22+00:00,sentir que falam mal de ti nas tuas costas é um sentimento horrível
1397155696773410816,2021-05-25 11:40:50+00:00,"Horrível, a vida é horrível"
1397155181326909445,2021-05-25 11:38:47+00:00,Essa tua nova versão de pessoa é só horrível
1397155111827300360,2021-05-25 11:38:31+00:00,"@troublemaker_86 É horrivel, fdx."
1397154136777441281,2021-05-25 11:34:38+00:00,@vert_gum tive q fazer um trabalho sobre esse gajo foi horrível foi tp 2 minutos
1397150818277658625,2021-05-25 11:21:27+00:00,Coisa horrível
1397149075976429575,2021-05-25 11:14:32+00:00,Eu as vezes acho que sou uma pessoa horrível… e depois vou a ver e sou mesmo! 😂
1397148974809849857,2021-05-25 11:14:08+00:00,Tosquia feita e sinto-me menos horrível!
1397145297248309254,2021-05-25 10:59:31+00:00,"Há tantos concepts nices e pedem esta merda? Ok a primeira é uma cena nice mas é obviamente falsa, a segunda é só horrível https://t.co/FY7INm2oqN"
1397144544056070146,2021-05-25 10:56:31+00:00,"atualmente to vendo mt video de comida asiática e fico muito indignada que pessoas não-vegan comem tofu no dia a dia

gente eu SOU VEGAN E EU NAO CONSIGO GOSTAR DESSE NEGOCIO, todo mês eu compro na esperança de gostar com receitas novas mas fica sempre horrível"
1397143068873306113,2021-05-25 10:50:39+00:00,Ok mas compal é horrível https://t.co/evjw0FqeD8
1397141587264671748,2021-05-25 10:44:46+00:00,Brooos q calor horrível
1397141273891545090,2021-05-25 10:43:31+00:00,Dia tão horrível para vocês me foderem a cabeça
1397139667905024000,2021-05-25 10:37:09+00:00,@naturalmente___ Mano horrível! Apanhei 3 acidentes é uma operação stop
1397139487025770496,2021-05-25 10:36:25+00:00,"@Misslucifer2016 O disco é horrível, ele tem letras boas, mas não são boas músicas"
1397135269636214784,2021-05-25 10:19:40+00:00,"@Pirikito1982 Essa última parte então, é horrível!!"
1397133369910120450,2021-05-25 10:12:07+00:00,Fzer esse teste sozinho é horrível... da maneira que pedem pra espetar o cotonete na garganta che 😂
1397133246174007296,2021-05-25 10:11:38+00:00,@mvcavaco É horrível.
1397131512726884352,2021-05-25 10:04:44+00:00,@nicasdodrip Ta horrível
1397129833524641794,2021-05-25 09:58:04+00:00,"@sous_tiz É o gerúndio de Carlar, horrível"
1397128754066071554,2021-05-25 09:53:47+00:00,Ai eu hoje estou com um humor horrível! Tudo me está a atrofiar o cérebro não tenho paciência para vocês
1397122661751345153,2021-05-25 09:29:34+00:00,@sarap_25 @PorcoComClasse Yh imagina o que é vires ao mundo e viver a saber que os teus pais n te queriam... deve ser horrivel
1397118973154676739,2021-05-25 09:14:55+00:00,"@hs73____ Já. A defesa foi horrível e fiquei metade do tempo com o pc a morrer a tentar carregar o unity. 

Por cada clique naquilo eram 3 minutos do meu grupo e do stor a olhar para uma barra de loading"
1397118413869391873,2021-05-25 09:12:41+00:00,Ok tive um sonho horrível
1397116827592011777,2021-05-25 09:06:23+00:00,@sir_alexandre12 Isto hoje está horrível
1397110764616437761,2021-05-25 08:42:18+00:00,"@AnaisaAlves1 Opa eu pus, já que o texto em si está horrível, ao menos tem a capa decente 😂"
1397107907439833088,2021-05-25 08:30:56+00:00,sushi é horrivel fi https://t.co/exWRyqH4VI
1399354996223885319,2021-05-31 13:20:04+00:00,Herói bem feio... nothing against Jews mas a estrela de David é horrível... you either have an odd pointed star or you don’t... https://t.co/hoBVnZRRlR
1399354584817078273,2021-05-31 13:18:26+00:00,"@dweilish ah ta vc ta fld de investimento, no comeco eu acompanhei e foi horrivel kkk os anitters esperaram tth e receberam playlist do hugo gloss, agora com rádio melhorou"
1399353639781740545,2021-05-31 13:14:41+00:00,"@betasensata @joanamatos258 Não vai acontecer, o Bruno teve comportamento horrível e nojento porque sentiu-se atacado com o "" palhaço "" (sem razão)... Mas posso estar enganado."
1399351158163099652,2021-05-31 13:04:49+00:00,Macacão mais horrível preferia andar nua... me diz aí o género da minha pele https://t.co/fA3p47Y4td
1399349839138336771,2021-05-31 12:59:34+00:00,Bullying é boe horrivel!
1399349570707111939,2021-05-31 12:58:30+00:00,@dweilish mas tbm ne gfr foi flood e foi horrivel ngm aguentava mais
1399348345190195201,2021-05-31 12:53:38+00:00,Este hospital de ptg é demasiado horrível mano.
1399346563147829250,2021-05-31 12:46:33+00:00,"E eu que pertubei meio mundo querendo uma rede e agora que tenho descobri q o balanço me deixa enjoada.
Que morte horrível!"
1399344695151583232,2021-05-31 12:39:08+00:00,"@sul_dragao @rodrima1976 Não tem ninguém, ele esteve este tempo todo à espera do quê?  Com aquele estilo de jogo(de equipa pequena, robotizada) feitio horrível, ninguém o quis."
1399343895633346560,2021-05-31 12:35:57+00:00,@apasmaceira és uma pessoa horrível
1399343696198438913,2021-05-31 12:35:10+00:00,It's the way que eu e a minha irmã estamos a passar uma fase horrível das nossas vidas juntas e nem conseguimos estar uma para a outra para nos apoiarmos de tão mal que estamos
1399342056313655298,2021-05-31 12:28:39+00:00,@BenficaTransfer Jogador horrível
1399340801856086016,2021-05-31 12:23:40+00:00,Morte horrível https://t.co/v6au1q1XoY
1399339999213015057,2021-05-31 12:20:28+00:00,"Assinando a  Convenção do @coe contra o #TraficoHumano como primeiro país não-europeu significa o compromisso de #Israel  em combater este fenómeno horrível, reforçando o nosso papel como um actor global nesta luta crítica.

@UNODC
@osce_cthb
#UNTOC https://t.co/pUk8jEPDha"
1399336272473333760,2021-05-31 12:05:40+00:00,a mim devem me ter tirado só pode pq esta net está horrível desde manhã 🤦🏻‍♀️🤦🏻‍♀️ https://t.co/0zIT1oGEtf
1399335274086375425,2021-05-31 12:01:42+00:00,Que dia horrível mm
1399334390120030210,2021-05-31 11:58:11+00:00,Que este sentimento horrivel passe o mais rápido possivel... 🥺
1399333997650526210,2021-05-31 11:56:38+00:00,@dmxtilde Horrível mm
1399333959176273923,2021-05-31 11:56:28+00:00,"Voltar de férias é Horrível, não recomendo nota 2/10"
1399333191257935881,2021-05-31 11:53:25+00:00,"Está só a ter um dia horrível, cancelem este dia por favor"
1399332531078586371,2021-05-31 11:50:48+00:00,sushi de supermercado é horrível mas está a ser exatamente o meu almoço por escolha própria
1399315910868049924,2021-05-31 10:44:45+00:00,"@guileeeerme Eu to com inveja dele ter dinheiro pra fazer isso pq eu queria também hahahahha o do Brasil pra mim é horrível, o de Portugal é melhor, mas ainda não é o 100% que eu queria"
1399313879793025024,2021-05-31 10:36:41+00:00,@MarianaMendesA3 Nem devo de ir...está mesmo horrível
1399313380574388225,2021-05-31 10:34:42+00:00,"Nutella é horrível, como é que voces comem isso? Tuli creme dá 10-0 

Masss n critico quem goste, sao gostos"
1399310912700432386,2021-05-31 10:24:54+00:00,@questamerdaa Ciúmes nada ele que é horrível mesmo kkkkkkkkkkkkkkkkk mlk so grita
1399307835939463173,2021-05-31 10:12:40+00:00,"cada vez que digo que vou à praia, o tempo decide estar horrível"
1399307618338983937,2021-05-31 10:11:48+00:00,"O gajo não é mau, é horrível https://t.co/RY15Qysgk9"
1399305507534483457,2021-05-31 10:03:25+00:00,"Protestos de feministas mas parece comercial de bordel, é cada uma mais horrível de que a contra, pior, odeiam um salão de beleza. Ninguém sabe começa os pentelhos e onde termina. Só vejo e riu."
1399302702547537922,2021-05-31 09:52:16+00:00,"É horrível não ter nada para fazer, mas é maravilhoso não ter de fazer nada."
1399288108768710657,2021-05-31 08:54:17+00:00,@joelnovin Então estás completamente horrível
1399287665724432384,2021-05-31 08:52:31+00:00,"Logo vou a uma fisioterapeuta para me tirar uma contratura horrível que tenho na dorsal. 
Se sei que vou sofrer imenso? Sei.
Se estou preparada? Obviamente que não 🥲🥲"
1399287640210513921,2021-05-31 08:52:25+00:00,Tou horrível hj
1399286533643984896,2021-05-31 08:48:01+00:00,Nem sei ao certo se me estou a sentir gira ou horrível e gorda kkkkk
1399285003637374977,2021-05-31 08:41:56+00:00,@WeAreLivpool Horrível
1399282263250989058,2021-05-31 08:31:03+00:00,Caramulo – Ascensão e Queda de uma estância de Tuberculosos: Mas quem foi o visionário desta estância do Caramulo? Quem esteve por detrás desse gigantesco empreendimento num local geograficamente “ideal” para a cura desta horrível doença? https://t.co/xGk40SxoXw
1399275854539145218,2021-05-31 08:05:35+00:00,"@oFernandoDaniel Cenário horrível, jurados horríveis, apresentadora horrível, programa horrível."
1399268191692599296,2021-05-31 07:35:08+00:00,"@JogadoresGalo Que estava lá, Gandalf... Último jogo que meu pai animou a ir comigo, viramos com o gol do Catanha, ""O Águia"" é em 20 minutos o Diego Alves falhou 3x... Que dia horrível... É pelo visto seguimos perdendo pontos pro fostsleza quase 20 anos depois, eh galo me ajuda a te ajudar"
1399257895620038656,2021-05-31 06:54:13+00:00,q noite horrível
1399257769576906755,2021-05-31 06:53:43+00:00,Mano que pesadelo horrível caralho
1399251785706086403,2021-05-31 06:29:57+00:00,tá um tempo horrível
1399248214684061696,2021-05-31 06:15:45+00:00,Tinha muitos planos delineados para esta manhã. Mas depois desta noite horrível vou só dormir depois de deixá-la na escola 😕
1399237008464166913,2021-05-31 05:31:14+00:00,q noite horrível
1399227825765421057,2021-05-31 04:54:44+00:00,"@delfinz_ já joguei mt stardew valley antes de dormir com esse app
problema é que o controle tem que estar com pilha e isso é horrivel 😔"
1399213128274034689,2021-05-31 03:56:20+00:00,"Já não tinha pesadelos à imenso tempo, que sensação horrível."
1399212115857190912,2021-05-31 03:52:19+00:00,"@LeonelRadde Eu vi o video, estava circulando pelo Twitter. É daqueles q te causam vergonha alheia. 
Que horrível!! Mais um beócio sujando o nome do Brasil no exterior."
1399197695751954432,2021-05-31 02:55:01+00:00,"Como é horrível ficar doente, não aguento mais 😰"
1399190630031663109,2021-05-31 02:26:56+00:00,que domingo horrivel
1399184608441274368,2021-05-31 02:03:00+00:00,@dachspno Todo técnico vira horrível com essa nabaiada. Trocamos técnico toda hora e a base do time se mantém
1399183459332067333,2021-05-31 01:58:26+00:00,Está um calor horrível mas eu não consigo dormir destapada.😭
1399181347390955525,2021-05-31 01:50:03+00:00,@ChupamosDeLado por acaso só reparei agora que disseste. que ser humano horrível
1399174890247405568,2021-05-31 01:24:23+00:00,"@skinrosadotaric Enfim, foi horrível. Mas já passou, obrigado linda ♥️"
1399166470387556356,2021-05-31 00:50:56+00:00,@rankingshp Quem n votou na Molly deve ser um ser humano horrível
1399161307962789889,2021-05-31 00:30:25+00:00,"na praia , de bikini com um vento horrível"
1399157314033172489,2021-05-31 00:14:33+00:00,Que noite horrível
1399156068509437954,2021-05-31 00:09:36+00:00,Chocado q eu seguia este senhor no youtube. que morte horrível. https://t.co/5lqA5ZQThc
1399155304907034625,2021-05-31 00:06:34+00:00,Vai ser uma noite horrível!
1399149533192466433,2021-05-30 23:43:38+00:00,"sair de casa sem celular , é horrível"
1399145696549289998,2021-05-30 23:28:23+00:00,@ruiicardoso18 é horrivel :/
1399144612137259008,2021-05-30 23:24:05+00:00,"@aliciiia @dptaetti @Gremio concordo linda meu time é horrível mesmo, mas e aí… solteira?"
1399141836699099141,2021-05-30 23:13:03+00:00,Que partida horrível...
1399139987543764995,2021-05-30 23:05:42+00:00,Horrível criar uma imagem de uma pessoa na tua cabeça e depois ela ser decepcionante e não ser nada daquilo que demonstrava 🤮 odeio gente falsa/ mentirosa que força ser aquilo que não é
1399138138056966144,2021-05-30 22:58:21+00:00,"Que juiz horrivel meu deus, qualquer trombada ele da falta."
1399137917507878912,2021-05-30 22:57:28+00:00,"Contar pra vocês que eu não tenho nem um ano de esports, só alguns poucos meses, mas parece que eu tô aqui há muito tempo

Aconteceu um negócio horrível comigo esses dias aí que eu pensei que nunca fosse experienciar, mas obrigada por terem me abraçado e pedido p ficar."
1399133690987483139,2021-05-30 22:40:41+00:00,"semana horrível, esta ainda nem começou e já só quero que chegue ao fim"
1399131236933722117,2021-05-30 22:30:56+00:00,que jogo horrivel de parte a parte https://t.co/iHxXJEOpjG
1399129738971598849,2021-05-30 22:24:59+00:00,uma semana com menos um dia e mesmo assim vai ser horrível
1399128055226982404,2021-05-30 22:18:17+00:00,@tt_daEmyli Tbm quer ficar de fogo no cú de ficar nessa rua horrível
1399124782348738563,2021-05-30 22:05:17+00:00,@joaohartley @SLBenfica @marcelvolei Eu não tou a criar caso nenhum . Apenas mostrar a minha indignação ! É horrível . Forte abraço companheiro
1399124291741007874,2021-05-30 22:03:20+00:00,"@tchapatata @PedrooA09 Foi um jogo horrivel, com uma arbitragem pavorosa para os dois lados. Os meus Lakers já foram. O LeBron sozinho não chega. Os Suns tem 3-4 jogadores a sério."
1399124181552402435,2021-05-30 22:02:54+00:00,@catarinaparada_ Fica horrível:')
1399118090009464838,2021-05-30 21:38:41+00:00,@Stephenfor4 Sem AD? Muitíssimo negro. Que coisa horrível.
1399117081010966537,2021-05-30 21:34:41+00:00,O meu corpo é horrível
1399116828224458762,2021-05-30 21:33:40+00:00,"@pocahon21289486 Nem pensar !! Ele pode ser bom, mas nós temos mais kms ( que frase horrível 😥 até parece que sei andar de bicicleta😂)"
1399116159752998913,2021-05-30 21:31:01+00:00,@Pedrosi17484734 broo cogumelos é horrível
1399113197295222791,2021-05-30 21:19:15+00:00,Voltar a flr com uma gaja q já falei antes é tão horrível man!
1399112818159403008,2021-05-30 21:17:44+00:00,"E apenas para constar, o Rony é horrível."
1399112441791909898,2021-05-30 21:16:15+00:00,"Ainda estou a pensar que vi ontem aquele acidente horrível em direto e nunca pensei que fosse a última vez que te ia ver em cima de uma mota...
Ainda não acredito, a vida é injusta, um campeão tão novo que se foi 

Ride in peace Jason 🖤⭐️ https://t.co/Kr6RXCwQ5S"
1399111818212225025,2021-05-30 21:13:46+00:00,Diminuir alguém para aumentar outro é horrível
1399111324630761479,2021-05-30 21:11:48+00:00,"@M_Matos61 A pornolalia é uma coisa muito séria. Junto as declarações de um paciente afectado por tão horrível enfermidade. 
https://t.co/znbPsXJI9w"
1399108936519897094,2021-05-30 21:02:19+00:00,"Meu filho tem dias, e tem gente achando q eu vou levar ele pra rua ou pra conhecer alguém c essa pandemia horrível e nesse tempo frio. Não sou doida não!"
1399108304723492867,2021-05-30 20:59:48+00:00,Tou a descolorir a sombrancelha e uma parte do cabelo espero que não fique horrível vou me matar
1399108017698873344,2021-05-30 20:58:40+00:00,@gaytawaycar essa capa horrível
1399107932546011144,2021-05-30 20:58:19+00:00,"jogo horrível mas é isso, ganhamos 👍🏾"
1399107833145200647,2021-05-30 20:57:56+00:00,pelo amor de deus rafaela fazendo a gente assistir um filme horrível aqui puta que pariu
1399106931088887822,2021-05-30 20:54:21+00:00,"@filipeduarte_ Importante fazer isso uma vez por ano, pelo menos, tem que usar cerumin (horrível) por uma semana antes da limpeza"
1399105441565655042,2021-05-30 20:48:26+00:00,@DoraExp89044048 ÉS HORRÍVEL 😭😭😭
1399105363459334147,2021-05-30 20:48:07+00:00,@povdua eu achei horrivel
1399103524647194624,2021-05-30 20:40:49+00:00,Receber agora uma notícia desta acabou comigo !! Que maneira horrível de acabar o fim de semana
1399102302800199684,2021-05-30 20:35:57+00:00,Horrível msm é quando a tua própria família diz que tu não és capaz...
1399101338596921345,2021-05-30 20:32:07+00:00,Só eu que acho que o Daronco é horrível? Que juiz fraco...
1399100691004657666,2021-05-30 20:29:33+00:00,Fim de semana horrível 🤡
1399097247468605440,2021-05-30 20:15:52+00:00,Aqui vou eu treinar que este corpo está mm horrível
1399095015410913282,2021-05-30 20:07:00+00:00,@simpraisa Como jogar com um gramado horrível desse. A bola vai quicando em qualquer passe.
1399093370853769224,2021-05-30 20:00:28+00:00,"@laraanjito Com bolha ou sem bolha acho horrível permitirem turistas que andei na rua a cruzar-se connosco sem máscara. E por exemplo falo de casais com filhos e tudo, portanto nao são só hooligans."
1399093159855116288,2021-05-30 19:59:37+00:00,O Rio Ave deve estar mesmo horrível para levar um agregado de 5-0 do Arouca
1399093075042000902,2021-05-30 19:59:17+00:00,"Sobre a ""humorista"", meus cinco centavos: ela virou mártir de bolsonarista, que morte horrível. https://t.co/XHxu7Asr9k"
1399092945870012418,2021-05-30 19:58:46+00:00,"O meu dia está a ser horrível, mas uma vitoria dos Suns resolvia tudo"
1399091886342787076,2021-05-30 19:54:34+00:00,Muito triste o Rio Ave descer à segunda liga mas é inteiramente merecido. Uma segunda volta de campeonato absolutamente horrível. Não marcam um golo há vários jogos. Um desastre. 13 épocas depois o Rio Ave desce de divisão.
1399091789731147776,2021-05-30 19:54:11+00:00,Ninguém mas ninguém tem o direito de humilhar assim uma mulher..e escrever aquilo nas redes sociais.e horrível. Por ali se vê o carácter deste senhor..eu estou chocada.. é nojento de mais.😩
1399090990556889092,2021-05-30 19:51:00+00:00,@misssonica @jonasnuts 6:15 da manhã? Ena :) Obrigado pelo convite mas sou mesmo horrível para andar em grupo. 😀
1399088742686732291,2021-05-30 19:42:04+00:00,"So gosto de ver alguns jogos por causa das jovens promessas, nisso sim, são melhores.
Agora de resto, é horrível."
1399088288376496131,2021-05-30 19:40:16+00:00,"E ainda me vem dizer os brasileiros que o brasileirao é melhor que o nosso 😂😂
Estou a ver supostamente as duas melhores equipas e isto é horrível 😂😂
O Braga ganhava a libertadores fácil"
1399087797022216199,2021-05-30 19:38:19+00:00,"Se não fosse o Diego Alves já era goleada, que zaga horrível"
1399085099019296780,2021-05-30 19:27:36+00:00,"@louououli @LoveIsNeededNow É horrível,  monstruoso!!!"
1399083639082737669,2021-05-30 19:21:47+00:00,Vou só fingir que a minha cara não está horrível e vou deixar isto aqui não estou a saber lidar ainda https://t.co/yqPwgaU2w2
1399082014431666184,2021-05-30 19:15:20+00:00,@h8riven @Esmeral31612559 Tens razão mas tb se ele não continua a lançar perde confiança e a prova é que Riley ainda se tornou o melhor marcador do Porto.  Mas 0 pontos ao fim da 1a parte é horrivel .
1399073601945583618,2021-05-30 18:41:54+00:00,Ok isto foi horrível até fiquei a tremer
1399068938244341767,2021-05-30 18:23:22+00:00,@FCPorto 3 período horrível. Quarta é pra jogar como nos últimos minutos sff
1399067137025662976,2021-05-30 18:16:13+00:00,"eu sei que o universo cyberpunk é horrível, literalmente o pico do capitalismo futurístico

MAS por causa da sua história incrível, gostava muito de ver como seria viver no mundo de VA-11 HALL-A https://t.co/WV4VGNPKlp"
1399062256751624192,2021-05-30 17:56:49+00:00,@ana_leandro16 Meu deus...que jogo horrivel
1399061417114976270,2021-05-30 17:53:29+00:00,"@lordjimpt Já tinha lido sobre isto! Esta sensação de impotência é horrível.
És realmente uma pessoa incrível Lord Sharky"
1399061102651138053,2021-05-30 17:52:14+00:00,"Mais um negócio horrível da nossa direção 
Continuem https://t.co/GAGbwsYMAZ"
1399061087673221123,2021-05-30 17:52:11+00:00,@ullmannbot @pipsdepressivs @desintegraca0 Femismo imo. After eight é horrível. Devia ser exterminado
1399060708931813382,2021-05-30 17:50:40+00:00,@SCPModalidades Que arbitragem horrível
1399060201920249861,2021-05-30 17:48:40+00:00,O que aconteceu em Portugal com a final da Liga dos Campeões foi só ridículo e absurdo! A imagem que passou para fora foi horrível..
1399056923840987146,2021-05-30 17:35:38+00:00,N me perguntem pq mas o cheiro a testículos de veado é horrível e enjoativo
1399050151302467588,2021-05-30 17:08:43+00:00,"Compreendo q n percebam o facto de eu n gostar nd do meu corpo pq aos seus olhos o meu corpo n é como eu descrevo e bla bla. Só me magoa n fazerem um esforço p pelo menos aceitarem o meu lado, q n me sinto confortável p determinadas cenas. Acham que quero ser assim? É horrível."
1399038438821793797,2021-05-30 16:22:11+00:00,@kkhanimambo História Horrível??
1399037737152528390,2021-05-30 16:19:24+00:00,"Esta época de exames é realmente horrível e desumana e ainda nem chegou o pior, em meados de julho, uma tosta do crl e eu sentada a estudar, não era mais fácil ganhar a vida a vender droga? Epah farta"
1399031766510358529,2021-05-30 15:55:40+00:00,@laridelgrey so em arraial e spa que eu saiba mas falam q o de arraial é horrível
1399030339792683019,2021-05-30 15:50:00+00:00,@nunocalvin Horrível estar num sítio e o simples acordar de manhã nos faz tremer e ter ansiedade... E sentirmos nos mal o dia todo....
1399028429316624394,2021-05-30 15:42:24+00:00,Apatia horrível
1399026730485047303,2021-05-30 15:35:39+00:00,"Não desejo isso a ninguém, que coisa mais horrível"
1399025599264534531,2021-05-30 15:31:10+00:00,Foi horrível fds
1399023796783304704,2021-05-30 15:24:00+00:00,Que horrível
1399017628417527814,2021-05-30 14:59:29+00:00,"Há brincadeiras e brincadeiras. 
Esta é horrível. Aliás nem brincadeira é. Só mesmo estupidez. 
Saberem que a mãe se encontra num desespero e numa dor inqualificável e ainda brincar. 
Sou grande adepta do humor negro mas isto já ultrapassa todos os limites. https://t.co/F39hwQEshE"
1399016841490616320,2021-05-30 14:56:22+00:00,@heatherszs a roupa horrível
1399016638909980673,2021-05-30 14:55:33+00:00,"@heatherszs que homem horrível, jesus"
1399015590891823105,2021-05-30 14:51:23+00:00,@Mineirao horrível
1399014610309681152,2021-05-30 14:47:30+00:00,"@AVascainos Quem tem um pisicologico horrivel e o Andrey, nao da mais a oscilação dele é tao grande  que um jogo joga bem o outro entrega, nao vale apena arriscar ter ele em campo para ele xometer mais uma erro e entregar. Qtas vezes mais teremaos q ver isto acontecer?"
1399009355106770944,2021-05-30 14:26:37+00:00,"Mas que calor horrível é este ? Não consigo lidar, sai fora"
1399007559298818048,2021-05-30 14:19:29+00:00,@ddhell3 Acho horrível esse e kirinmaeu com as meninas
1399003792830611463,2021-05-30 14:04:31+00:00,que sensação horrível...😶
1398996555668111364,2021-05-30 13:35:45+00:00,@akccm Horrível. Será que é coisa brazuca?
1398996518263209985,2021-05-30 13:35:36+00:00,Ter de estudar cm este tempo é horrivel
1398996085822087168,2021-05-30 13:33:53+00:00,@leticiaSilvah01 Horrível mesmo😭
1398995531578417155,2021-05-30 13:31:41+00:00,@joaopnevess Mano eu fiquei horrível nessa foto
1398993368504492032,2021-05-30 13:23:05+00:00,@__maiisa__ Cala te eu tenho uma cabeca de alien ia ficar horrível
1398991376583479296,2021-05-30 13:15:10+00:00,"@Arquibancad1893 @TransferFcporto @ojogo Sim concordo sem dúvida que sim, basta ver este Igor Cássio que veio do Brasil, horrível! Mas este Malik pelo que conheço dele já desde o Vizela gosto do rapaz, forte fisicamente e finalizador, esperemos que não seja um falhanço"
1398989365980942339,2021-05-30 13:07:11+00:00,Cerveja preta é horrível
1398989164935368709,2021-05-30 13:06:23+00:00,O quanto isto está a doer é horrível
1398985654873296903,2021-05-30 12:52:26+00:00,"@andre_ramalho6 Horrível como lhe tiraram o segundo lugar mano, incompreensível"
1398985303969443844,2021-05-30 12:51:03+00:00,"Esta direção de corrida do MotoGP é horrível, tiram o 2° lugar ao Miguel e depois voltam a dar, que gozo"
1398982040167538688,2021-05-30 12:38:04+00:00,"Tenho uma borbulha horrível no nariz, sei bem quem mandou mau olhado para o meu nariz perfeito"
1398975845855866881,2021-05-30 12:13:28+00:00,Isso é tao horrivel https://t.co/J81fZmY5Ar
1398975314647207944,2021-05-30 12:11:21+00:00,@matos_otilia Tb a mim! Há gente msm horrível 🤬
1398972163516997636,2021-05-30 11:58:50+00:00,Minha auto estima está horrível.
1398971436950302720,2021-05-30 11:55:56+00:00,"@protagonisma Ainda bem que não fui para isso, que horrível juro, mas boa sorte para as duas disciplinas tu vais conseguir eu acredito 🙏🏻💚"
1398967749431500801,2021-05-30 11:41:17+00:00,@joaomftorres Estava cheio e já com reservas e não queríamos esperar. Viemos ao cantinho d'avo. Se for horrível não quero saber 🤣
1398966140555177990,2021-05-30 11:34:54+00:00,O que estão a fazer com a Angélica é horrível! Tentarem engana-la numa altura destas é só desumano!
1398964221153579008,2021-05-30 11:27:16+00:00,"Acabei de saber uma história horrível. 
Uma mãe perdeu uma bebé aqui no Porto, roubaram lhe o carro, e no carro estavam as cinzas da bebé. 😥
Não paro de pensar neste assunto desde que li.
Que mundo é este..."
1398963227887874048,2021-05-30 11:23:19+00:00,"@10_danielalves @_Goalpoint Abdu conte , zaidu e nilton varela. Isso é que era o mau, o horrivel e o péssimo"
1398962471721971712,2021-05-30 11:20:19+00:00,Estou com uma dor de costas estupidamente horrível
1398962093127344134,2021-05-30 11:18:49+00:00,olho-me ao espelho e sinto me só horrível
1398961545317601281,2021-05-30 11:16:38+00:00,@Cl4udio71 @adoreurueI q horrivel acabei d ver um video aq coitado
1398961267914817537,2021-05-30 11:15:32+00:00,"Eu venho com um top para o trabalho pq com a camisa e os fornos, eu fico muito suada, mas o processo de ter de passar por homens, com o top, até chegar ao trabalho é horrível, pq parece que nunca viram um par de mamas...."
1398960385911406592,2021-05-30 11:12:02+00:00,"@iiinesssssss fds que horrível, o meu nariz pinga q farta, ontem tava c olhos todos vermelhos"
1398956535611637761,2021-05-30 10:56:44+00:00,Que notícia horrível. Dupasquier 🤍
